"BIBLIOGRAFIA";"AUTOR";"TITULO";"FECHA";"CRITERIO";"BLOQUE";"MEDIO";"SOPORTE";"TEMA";"PAIS";"ZONA";"TIPOLOGIA";"NOTAS";"CONCORDANCIA";"Valida"
"Montero, Reinaldo: La visita de la Infanta. La Habana: Editorial Letras Cubanas, 2005.";"Montero, Reinaldo";"La visita de la Infanta";2005;"Primera edición";"Ficción";"Escrito";"Libro";"Novela";"Cuba";"Antillas";"Ficción";;", porque qué de decorados en el palco real y los demás palcos, qué elegancia, Dios, hay butacas nuevas, hay alfombrado nuevo, habrá música fina, artistas refinados, refrigerio pomposo, luz abundante, Dios, hemos ido más allá del embellecimiento, si ya no sabemos qué más hacer, en qué más agradar, qué más gastar, porque no tememos gastar, que se gaste lo que se gaste, sí tememos que algo parezca deslucido, Dios, líbranos de esa posible vergüenza, porque la única ley ahora en La Habana, encantadorcísimos y respetabilísimos agasajados, es halagaros.";"no"
"Carabias, Julia; Landa, Rosalva: Agua, medio ambiente y sociedad. Hacia la gestión integral de los recursos hídricos en México. México D. F.: El Colegio de México, Universidad Nacional Autónoma de México, Fundación Gonzalo Río Arronte, 2005.";"Carabias, Julia; Landa, Rosalva";"Agua, medio ambiente y sociedad. Hacia la gestión integral de los recursos hídricos en México";2005;"Primera edición";"No ficción";"Escrito";"Libro";"Ciencias y tecnología";"México";"México y Centroamérica";"Académico";;"van a distribuir los costos entre los diferentes grupos de la población y volúmenes de consumo. Al respecto, el diseño de las tarifas ofrece, cuando menos, tres opciones. La primera es que los usuarios paguen el costo real del agua que consumen, independientemente de su condición social. La segunda es que quienes más tienen y más consumen, paguen más. Y la tercera es que, con independencia de la condición socioeconómica, la segunda unidad de agua consumida cueste más que la primera, que la tercera unidad cueste más que la segunda, y así sucesivamente.";"no"
"Carabias, Julia; Landa, Rosalva: Agua, medio ambiente y sociedad. Hacia la gestión integral de los recursos hídricos en México. México D. F.: El Colegio de México, Universidad Nacional Autónoma de México, Fundación Gonzalo Río Arronte, 2005.";"Carabias, Julia; Landa, Rosalva";"Agua, medio ambiente y sociedad. Hacia la gestión integral de los recursos hídricos en México";2005;"Primera edición";"No ficción";"Escrito";"Libro";"Ciencias y tecnología";"México";"México y Centroamérica";"Académico";;"los costos entre los diferentes grupos de la población y volúmenes de consumo. Al respecto, el diseño de las tarifas ofrece, cuando menos, tres opciones. La primera es que los usuarios paguen el costo real del agua que consumen, independientemente de su condición social. La segunda es que quienes más tienen y más consumen, paguen más. Y la tercera es que, con independencia de la condición socioeconómica, la segunda unidad de agua consumida cueste más que la primera, que la tercera unidad cueste más que la segunda, y así sucesivamente.";"no"
"Meléndez, Miriam: «El auditor». Cruzando el puente. Hato Rey: Publicaciones Puertorriqueñas, 2005.";"Meléndez, Miriam";"Cruzando el puente";2005;"Primera edición";"Ficción";"Escrito";"Libro";"Teatro";"Puerto Rico";"Antillas";"Ficción";;"El auditor —Mantén aún más recta tu espalda, más equilibrada la cabeza y la mirada más directa..";"no"
"García Jaime, Luis: «Las treinta monedas». Teatro: ¡Ese hombre!, Las treinta monedas. Guayaquil: Proyecto de Rescate Editorial de la Biblioteca Municipal de Santiago de Guayaquil, 2005.";"García Jaime, Luis";"Teatro: ¡Ese hombre!, Las treinta monedas";2005;"Primera edición";"Ficción";"Escrito";"Libro";"Teatro";"Ecuador";"Andina";"Ficción";;"REY: (Elevando fuertemente la voz). Estáis equivocado, señor, aquí no hay más amo, más señor, más Majestad y más Jefe y quien decide todo que EL REY y ése, señor Cardenal (gritando). SOY YO. Reflexionad un momento que si yo he dicho e impuesto mis palabras -que siempre serán una orden- primero (pausa) a la persona que más quiero, admiro";"no"
"Paredes, Roberto: El Somozano: novela sobre un ajusticiamiento. Asunción: s. n., 2005.";"Paredes, Roberto";"El Somozano: novela sobre un ajusticiamiento";2005;"Primera edición";"Ficción";"Escrito";"Libro";"Novela";"Paraguay";"Río de la Plata";"Ficción";"Faltan las hojas 82 y 83 pero parecen estar en blanco también en el original porque no hay salto en la historia ni incoherencias. Tampoco están las 94 y 95, aquí sí se ve que falta texto pero parece ser un fallo del libro y no del escaneo porque hay dos hojas en blanco.";"El nuevo lugar ofrecía ventajas con respecto al anterior, en el sentido de que era más protegido; más amplio, cercado de bosques tupidos. Desde el punto de vista de la estadía, sin embargo, era más problemático, lo cual obligó al grupo a dividir a quienes debían estar en el cuarto de varones y en el de mujeres. La vieja edificación era amplia, pero con pocos cuartos.";"no"
"García Jaime, Luis: «¡Ese hombre!». ¡Ese hombre!; Las treinta monedas. Guayaquil: Proyecto de Rescate Editorial de la Biblioteca Municipal de Santiago de Guayaquil, 2005.";"García Jaime, Luis";"¡Ese hombre!; Las treinta monedas";2005;"Primera edición";"Ficción";"Escrito";"Libro";"Teatro";"Ecuador";"Andina";"Ficción";"El texto contiene numerosos errores ortográficos";"OSCAR: Gracias don Jorge, muchas gracias. Me da usted a la mujer más bella y más inteligente del mundo. I tú, querida Yolanda, siempre serás la más amada, la más querida, la más deseada y respetada por mí. Te amo, mi vida.";"no"
"Trelles Paz, Diego: El círculo de los escritores asesinos. Canet de Mar: Candaya, 2005.";"Trelles Paz, Diego";"El círculo de los escritores asesinos";2005;"Primera edición";"Ficción";"Escrito";"Libro";"Novela";"Perú";"Andina";"Ficción";"El origen del autor del texto es diferente al lugar de publicación del mismo";"La misma noche en que propuso matarla con crueldad, Larrita se acostaría con ella y, desde entonces, nunca más volvió a agredirla. Más adelante perdió la perspectiva, el asunto se le fue de las manos cuando quiso defenderla como poeta. Una vez casi llega a los golpes con el Chato porque éste borracho y pesado le dijo que Emilia cachaba como la poeta más grande pero escribía con los pies.";"no"
"Realidad social de las mujeres sin techo, prostitutas, ex reclusas y drogodependientes en España. Madrid: Instituto de la Mujer (Ministerio de Igualdad), 2005.";;"Realidad social de las mujeres sin techo, prostitutas, ex reclusas y drogodependientes en España";2005;"Primera edición";"No ficción";"Escrito";"Libro";"Ciencias sociales, creencias y pensamiento";"España";;;;"Más hay de interna o más tiempo, externa igual pero, que sea desde las nueve hasta las siete, las ocho y aquí me han dicho a ayudar a ver trabajo, pero...""";"no"
"Llamazares, Julio: El cielo de Madrid. Madrid: Alfaguara, 2005.";"Llamazares, Julio";"El cielo de Madrid";2005;"Primera edición";"Ficción";"Escrito";"Libro";"Novela";"España";;"Ficción";;"Fue el comienzo del fin de nuestra historia, el detonante de su descomposición. Poco a poco, a medida que los días y los meses transcurrían, Eva empezó a volverse más seria, más lacónica y opaca, lo que provocaba en mí una mayor opresión de la que ya sentía desde hacía tiempo. Me hacía sentir culpable de algo de lo que yo no lo era, pues, si bien ella tenía derecho a cambiar de vida, yo también lo tenía a no quererlo. Lo cual";"no"
"Pascual, Javier: El Cantar de Gamyl. Madrid: Caballo de Troya, 2005.";"Pascual, Javier";"El Cantar de Gamyl";2005;"Primera edición";"Ficción";"Escrito";"Libro";"Novela";"España";;"Ficción";;"Mas sucedió que Zelik avanzó más rápido de lo previsto durante varios días y llegó más allá de lo aconsejable, pues ainda sabiendo que una fracción del enemigo se encontraba en el famélico pozo de el-Abib, no resistió la tentación de acercarse al pozo de Dumus, de aguas abundantes bien que salobres, el cual se";"no"
"Figueras, Josefina: Protagonistas de la moda. Madrid: Ediciones Internacionales Universitarias, 2005.";"Figueras, Josefina";"Protagonistas de la moda";2005;"Primera edición";"No ficción";"Escrito";"Libro";"Actualidad, ocio y vida cotidiana";"España";;"Divulgación";;"- Sí, por supuesto. Cada temporada es una prueba, un juicio. Yo soy una persona poco estable, con frecuentes cambios de estado de ánimo. Para mí cada colección es un trauma, casi una enfermedad. Me preocupo mucho, porque nunca hago nada a la ligera. Si no hago más es porque no doy más de sí... pero es muy gordo que el ""New York Times"" te llame ""el caudillo de la moda española"". Todo esto me da una gran responsabilidad y también una gran vergüenza.";"no"
"Figueras, Josefina: Protagonistas de la moda. Madrid: Ediciones Internacionales Universitarias, 2005.";"Figueras, Josefina";"Protagonistas de la moda";2005;"Primera edición";"No ficción";"Escrito";"Libro";"Actualidad, ocio y vida cotidiana";"España";;"Divulgación";;". Se siguen haciendo los modelos de una forma totalmente artesanal. Ha cambiado en cuanto a la forma de pasar las colecciones y el estilo de los modelos. Los pases se han dinamizado y en la época de Dior, y también en los años 60, los modelos eran mucho más retóricos y complicados. Tenían más cortes, más drapeados. Ahora son más sencillos. La Alta Costura no varia en la forma de hacer, pero si en la construcción.";"no"
"Alonso, Francisco ... [et al.]: La justicia en el tráfico. Análisis del ciclo legislativo-ejecutivo a nivel internacional. Barcelona: Attitudes, 2005.";"Alonso, Francisco ... [et al.]";"La justicia en el tráfico. Análisis del ciclo legislativo-ejecutivo a nivel internacional";2005;"Primera edición";"No ficción";"Escrito";"Libro";"Política, economía y justicia";"España";;"Académico";;", eficacia..., las normativas y leyes vigentes en relación a los límites de velocidad, los límites de alcoholemia y el no uso del cinturón de seguridad, por ser, como hemos comentado las regulaciones cuyo incumplimiento suponen más riesgo para la seguridad vial. En este sentido, su incumplimiento, insistimos, ha de ser el más perseguido y el más sancionado. De hecho, veremos como en determinadas ocasiones, según nuestro código de circulación, las dos primeras pueden ser constitutivas de delito. Es decir, las circunstancias y consecuencias pueden sobrepasar la esfera de la infracción-sanción administrativa de tráfico y alcanzar el ámbito de ""lo penal"".";"no"
"Alonso, Francisco ... [et al.]: La justicia en el tráfico. Análisis del ciclo legislativo-ejecutivo a nivel internacional. Barcelona: Attitudes, 2005.";"Alonso, Francisco ... [et al.]";"La justicia en el tráfico. Análisis del ciclo legislativo-ejecutivo a nivel internacional";2005;"Primera edición";"No ficción";"Escrito";"Libro";"Política, economía y justicia";"España";;"Académico";;"En definitiva, el objetivo de la ley se diluye, prueba de ello es, como mencionábamos en determinado momento, que las leyes cuyo quebrantamiento suponen un mayor riesgo, deberían ser las más perseguidas y las más sancionadas. Esto no es así, ejemplos de ello, y queda para la reflexión, la última modificación de la ley de seguridad vial y/o los datos sobre infracción y sanción.";"no"
"Burgos, María: «Una gota de aceite hirviendo. Eros y Psique. Después de la carrera». Amestoy, Ignacio... [et al.] [ed.]: Teatro. Piezas breves curso Resad 2004-2005. Madrid: Editorial Fundamentos, 2005.";"Amestoy, Ignacio... [et al.] [ed.]";"Teatro. Piezas breves curso Resad 2004-2005";2005;"Primera edición";"Ficción";"Escrito";"Libro";"Teatro";"España";;"Ficción";;"23. pero qué más da cuando no duele qué más da cuando la sangre es música deslizándose y los insultos caricias qué más da hubiese querido más que esto claro hubiese querido más que esto y a la vez nada";"no"
"Fundación Española para la Ciencia y la Tecnología (FECYT): Percepción Social de la Ciencia y la Tecnología en España - 2004 . Madrid: (FECYT) Fundación Española para la Ciencia y la Tecnología, 2005.";"Fundación Española para la Ciencia y la Tecnología (FECYT)";"Percepción Social de la Ciencia y la Tecnología en España - 2004 ";2005;"Primera edición";"No ficción";"Escrito";"Libro";"Ciencias y tecnología";"España";;"Divulgación";;"También hay otra curiosidad a la hora de analizar las aportaciones negativas de la ciencia, que también son más recalcadas por los encuestados más religiosos, y es la contribución a incrementar las diferencias entre países ricos y pobres, en donde no creyentes y no católicos insisten más, pero no así los no practicantes.";"no"
"Ruedas de prensa del Consejo de Ministros del Gobierno español: Rueda de prensa del viernes 8 de septiembre de 2005. ";"Ruedas de prensa del Consejo de Ministros del Gobierno español";"Rueda de prensa del viernes 8 de septiembre de 2005";2005;"Fecha de transcripción";" ";"Oral";" ";;"España";;"Otros";;"nacional de atención a las personas discapacitadas creemos que el crecimiento de la economía debe ser también el crecimiento de la igualdad entre los ciudadanos // con una economía como la española / que está creciendo por encima de la media europea / nuestro país está en unas magníficas condiciones para cerrar un poco más la brecha social que separa a los que más tienen de los más desfavorecidos // todos los ciudadanos / también quienes menos tienen / deben verse beneficiados por el crecimiento económico del que se está beneficiando España en cuanto a las medidas que el Plan recoge para este año dos mil cinco / solamente les voy a citar algunas // por ejemplo / con el fin de garantizar el acceso a recursos y servicios de los más";"no"
"Ruedas de prensa del Consejo de Ministros del Gobierno español: Rueda de prensa del viernes 18 de noviembre de 2005. ";"Ruedas de prensa del Consejo de Ministros del Gobierno español";"Rueda de prensa del viernes 18 de noviembre de 2005";2005;"Fecha de transcripción";" ";"Oral";" ";;"España";;"Otros";;"a las perspectivas financieras en cuanto al segundo tema que me plantea / con el tema del CIS tan sólo dos cosas / primero / ya saben que no es costumbre de este Gobierno comentar las encuestas / ni cuando nos resultan favorables / ni cuando nos resultan menos favorables // segundo / yo creo que las encuestas hay que manejarlas como una herramienta de trabajo más / es un instrumento más de análisis // en este caso le diré que a dos años de las elecciones tienen el valor que tienen / que están ahí y que las analizamos junto con todos los demás datos que nos ofrece la realidad para hacer el análisis político // nada más";"no"
"«Marinos se impuso 99-86. Barrido el ""Expreso""». El Carabobeño. Valencia: el-carabobeno.com, 2005-07-04.";;"El Carabobeño";2005;"Primera edición";"No ficción";"Escrito";"Prensa";"Actualidad, ocio y vida cotidiana";"Venezuela";"Caribe continental";;;"Marinos de Anzoátegui demostró que es toda una aplanadora jugando en el ""Luis Ramos"" de Puerto La Cruz, al completar la barrida en el inicio de la serie semifinal contra Trotamundos de Carabobo, al vencer con pizarra de 99 puntos por 86. Jermaine Walker una vez más fue el más destacado por el ""Acorazado Oriental"" al anotar 32 puntos. Marinos supera 2 juegos por 0 al ""Expreso Azul"", equipo que tuvo en el debutante J.J. Miller a su mejor hombre con 22 unidades. En la otra serie, Panteras de Miranda empató a un juego por lado a";"no"
"«El libro del Picaflor». LR21. Montevideo: larepublica.com.uy, 2005-08-23.";;"LR21";2005;"Primera edición";"No ficción";"Escrito";"Prensa";"Actualidad, ocio y vida cotidiana";"Uruguay";"Río de la Plata";;;"- Troquílido, no meta el dedo en el ventilador... Cuando usted más aclara, más oscurece.";"no"
"«Merkel puede ser la primera mujer canciller». La Hora. Guatemala: lahora.com.gt, 2005-09-16.";;"La Hora";2005;"Primera edición";"No ficción";"Escrito";"Prensa";"Política, economía y justicia";"Guatemala";"México y Centroamérica";;;"Los comicios se realizan en un momento crucial para Alemania, con casi 83 millones de habitantes, el país más poblado y económicamente más fuerte de la Unión Europea (UE).";"no"
"Escobar, Roxana: «Salud y medio ambiente cobrarán caro por la quema». Eldeber.com.bo. Santa Cruz de la Sierra: eldeber.com.bo, 2005-09-25.";"Escobar, Roxana";"Eldeber.com.bo";2005;"Primera edición";"No ficción";"Escrito";"Prensa";"Salud";"Bolivia";"Andina";;;"chaqueo hace que los cornetes de la nariz crezcan y no dejen pasar el aire de forma normal, por lo que las personas se ven obligadas a respirar por la boca. A esto se suma el aumento de irritaciones conjuntivas. La pediatra Juanita Vargas es más drástica en su pronóstico y alerta que el resultado en cinco años más será más niños asmáticos, con bronquitis y cáncer de pulmón. Al parecer esto será inevitable, pues el jefe de unidad forestal dependiente de la Dirección de Medio Ambiente, Javier Collao, asegura que el departamento no se librará del humo, porque la quema es legal y permitida en el país, a través de autorizaciones de";"no"
"«""El Papa nos dio señales de santidad, devoción y entrega al Señor""». La Nación. Asunción: lanacion.com.py, 2005-04-04.";;"La Nación";2005;"Primera edición";"No ficción";"Escrito";"Prensa";"Ciencias sociales, creencias y pensamiento";"Paraguay";"Río de la Plata";;;"El prelado dijo que la muerte de Juan Pablo II ""fue, quizás, el viaje más preparado por él, más largamente preparado porque tenemos que reconocer que ha sufrido mucho, ha pasado momentos muy difíciles en su vida y especialmente en estos últimos tiempos"".";"no"
"Urrutia, Alonso: «Medios electrónicos trivializan la política y reducen ofertas electorales a 30 segundos». La Jornada. México D. F.: jornada.unam.mx, 2005-05-10.";"Urrutia, Alonso";"La Jornada";2005;"Primera edición";"No ficción";"Escrito";"Prensa";"Política, economía y justicia";"México";"México y Centroamérica";;;"Javier Aparicio, del Centro de Investigación y Docencia Económica (CIDE), señala que el gasto electoral en publicidad tiene un comportamiento muy volátil en función de diversas variables. No necesariamente quien gasta más obtiene más cantidad de votos.";"no"
"Rial Ungaro, Santiago: «""En el rock no está dicha la última palabra""». Página/12. Rosario: pagina12.com.ar, 2005-03-19.";"Rial Ungaro, Santiago";"Página/12";2005;"Primera edición";"No ficción";"Escrito";"Prensa";"Artes, cultura y espectáculos";"Argentina";"Río de la Plata";;;"que llegue el Zorro, y pronto lo hará enfundado en una remera con la imagen de Houses of the Holy de Zeppelin) están sentados en un sillón en la sala de estar del estudio El Pie, en Villa Urquiza. Juanse habla solo, sin necesidad de muchas preguntas, quizá porque la idea es hablar de lo que más sabe y lo que más le gusta: la música de los Ratones Paranoicos. El Rock & Roll. Cuando brama en Girando aquello de ""escuchemos el rock & roll/me gusta mucho como es!"" suena con la misma convicción que un predicador. Y si es considerado desde hace muchos años como una estrella de rock";"no"
"Soriani, Hugo: «Adriana». Página/12. Rosario: pagina12.com.ar, 2005-03-19.";"Soriani, Hugo";"Página/12";2005;"Primera edición";"No ficción";"Escrito";"Prensa";"Ciencias sociales, creencias y pensamiento";"Argentina";"Río de la Plata";;;"El incansable trabajo de los antropólogos permitió una vez más que sus familiares y amigos puedan, podamos, darle a Adriana un lugar donde dejar una flor cada vez que sientan la necesidad de hacerlo. Permitió una vez más ejercer el derecho quizás más antiguo del género humano: enterrar a sus muertos.";"no"
"Fabelo Corzo, José Ramón: «La vida humana ante los desafíos del capital (I): El legado de Marx». Revista cubana de filosofía. La Habana: revista.filosofia.cu/defau, 2005-05.";"Fabelo Corzo, José Ramón";"Revista cubana de filosofía";2005;"Primera edición";"No ficción";"Escrito";"Prensa";"Ciencias sociales, creencias y pensamiento";"Cuba";"Antillas";;;"El surgimiento del capitalismo representó un paso importante en este movimiento. No era ni con mucho la primera sociedad con relaciones de expropiación, alienación o enajenación, en la historia de Occidente. Pero sí constituía un sistema socio-económico en el que estas relaciones aparecían más veladas, más ocultas y, al mismo tiempo, con una potencialidad de autodestrucción desconocida hasta entonces.";"no"
"Mora Meléndez, Fernando: «Pasaporte en blanco». El Malpensante.com. Bogotá: elmalpensante.com, 2005-04.";"Mora Meléndez, Fernando";"El Malpensante.com";2005;"Primera edición";"No ficción";"Escrito";"Prensa";"Ciencias sociales, creencias y pensamiento";"Colombia";"Caribe continental";;"Periodicidad: bimestral. La preriodicidad ha variado con los años";"vida debe ser reconfortante porque significa aprender de la quietud. Ahorra más de una vuelta el saber que en todas partes se cuecen habas y que vayas donde vayas el mundo sigue andando. Entonces ¿para qué tanto afán por viajar? ¿Ser más interesantes?, tal vez. Pero si alguien ya no lo es, más vale que no busque más Itacas, como dice el poeta, porque entonces viajar puede convertirse en un pasatiempo de mediocres. Iremos chuleando museos con la misma necedad con que un colegial colecciona caramelos, para ufanarnos de ser cosmopolitas.";"no"
"«Antes de empezar». El País.com. Madrid: elpais.com, 2005-11-02.";;"El País.com";2005;"Primera edición";"No ficción";"Escrito";"Prensa";"Política, economía y justicia";"España";;;;"dos extremos. Paradójicamente, no sería de extrañar que, si es votada el próximo día 22 como la primera mujer canciller federal de Alemania, la democristiana Angela Merkel saliera reforzada de esta prueba. Pero de momento, el empresariado y la ciudadanía germanas, como el resto de la Unión Europea, ven con preocupación cómo su socio más poblado y más rico no logra salir de su marasmo y dotarse de un Gobierno efectivo.";"no"
"Sevilla, Jordi: «La política territorial del Gobierno». El País.com. Madrid: elpais.com, 2005-12-16.";"Sevilla, Jordi";"El País.com";2005;"Primera edición";"No ficción";"Escrito";"Prensa";"Política, economía y justicia";"España";;;;"España es de los países europeos que más crece y más empleo crea. Reparte esa mayor riqueza de manera solidaria mejorando los niveles de bienestar de sus ciudadanos. Amplía sus derechos y libertades a la vez que legaliza e integra a una inmigración necesaria. Y es visitada al año por unos 40 millones de turistas que saben que aquí están los Pirineos y no los Balcanes.";"no"
"Salomone, Mónica: «Cazadores de planetas». El País.com. Madrid: elpais.com, 2005-03-06.";"Salomone, Mónica";"El País.com";2005;"Primera edición";"No ficción";"Escrito";"Prensa";"Ciencias y tecnología";"España";;;;"enorme; hay que tener la mente abierta"". Marcy coincide: ""Sospechamos que los planetas se forman de muchas maneras, ni siquiera sabemos cuántas clases de objetos de masa planetaria hay. La palabra planeta no basta para incluir todos los mecanismos posibles de formación. Los astrónomos la seguiremos usando por ahora, pero a medida que sepamos más habrá también más variedad de términos"".";"no"
"Rodrigálvarez, E.: «Llorente se da un gustazo». El País.com. Madrid: elpais.com, 2005-01-20.";"Rodrigálvarez, E.";"El País.com";2005;"Primera edición";"No ficción";"Escrito";"Prensa";"Actualidad, ocio y vida cotidiana";"España";;;;"San Mamés se llevó eso en la retina: un hat trick memorable del muchacho en quien más confía y del que más desea. Claro que ayer enfrente estaba un rival que aguantó el chaparrón (meteorológico y deportivo) hasta el primer gol y al que sólo se le permitió soñar un instante cuando Lafuente repelió el disparo de Alejandro con 2-0 en el marcador. Luego llovieron goles, en la noche más";"no"
"Casado Esperanza, Francisco Javier: «Indisciplina, violencia y procesos educativos». Comunidad Escolar. Madrid: comunidad-escolar.pntic.mec.es, 2005-09-08.";"Casado Esperanza, Francisco Javier";"Comunidad Escolar";2005;"Primera edición";"No ficción";"Escrito";"Prensa";"Ciencias sociales, creencias y pensamiento";"España";;;;"en cuanto al proceso de enseñanza-aprendizaje no cabe duda de que sufre con esta situación. Son los mismos alumnos los que manifiestan que ""es imposible dar clase"" y ante la falta de calidad de la interacción profesor-alumnado la eficacia del sistema decrece y decrece. ¿para todos por igual? No, una vez más perjudica más a quién menos sabe y/o a quién menos ayuda familiar o externa en general puede recibir por sus condiciones socioculturales y económicas. Y nos damos de bruces con otro factor que favorece el fracaso y el abandono escolares.";"no"
