"BIBLIOGRAFIA";"AUTOR";"TITULO";"FECHA";"CRITERIO";"BLOQUE";"MEDIO";"SOPORTE";"TEMA";"PAIS";"ZONA";"TIPOLOGIA";"NOTAS";"CONCORDANCIA";"Valida";"cuantificador"
"«La Junta de la OIEA insta a Irán en una resolución a congelar de nuevo el enriquecimiento de uranio». Elmundo.es. Madrid: elmundo.es, 2005-08-12.";;"Elmundo.es";2005;"Primera edición";"No ficción";"Escrito";"Prensa";"Política, economía y justicia";"España";;;;"El portavoz dijo que Teherán ha cooperado con el Organismo Internacional de la Energía Atómica (OIEA), y que ""cuanto más pasa el tiempo más claro queda que las actividades nucleares de Irán son pacíficas, que no revisten ninguna ambigüedad y que no se apartan de la normativa internacional"".";"si";"cuanto"
"Burgos, Rosa: «La biosfera». Revista Natural. Madrid: revistanatural.com, 2005-03.";"Burgos, Rosa";"Revista Natural";2005;"Primera edición";"No ficción";"Escrito";"Prensa";"Ciencias y tecnología";"España";;;"Periodicidad: trimestral";"Estas primeras bacterias o móneras crecieron y se multiplicaron por todo el océano. Cuantas más había más modificaban la química de la Tierra, obtenían su energía mediante un proceso que implicaba la ruptura de las moléculas alimenticias proceso que se denominaba fermentación (son las bacterias que utilizamos hoy en día para hacer queso, yogur, vino y pan). Las llamaremos productoras de burbujas, puesto que generan burbujas que generan los";"si";"cuanto"
"Burgos, Rosa: «La biosfera». Revista Natural. Madrid: revistanatural.com, 2005-03.";"Burgos, Rosa";"Revista Natural";2005;"Primera edición";"No ficción";"Escrito";"Prensa";"Ciencias y tecnología";"España";;;"Periodicidad: trimestral";"Habría que valorar también otro proceso que se da en la evolución de los seres multicelulares que sería la consciencia, es decir, la capacidad de valorar y entender la posición/relación de cada ser y/o especie dentro de la escala evolutiva. En general parece claro que cuanto más aumenta la individual más fácil desconecta de su consciencia de especie. Quizás explique nuestra necesidad de perdurar, a pesar de lo que nos dice por ahora la ciencia, más allá del fin de nuestra existencia individual, o quizás se deba a que el subconsciente sabe que nuestra esencia vital ha recorrido infinidad de cuerpos y debe seguir";"si";"cuanto"
"El Búho: «Champagne, tensión superficial y guarradas en suspensión». EL BLOG DEL BÚHO. elblogdebuhogris.blogspot.com.es: elblogdebuhogris.blogspot.com.es, 2006-10-31.";"El Búho";"EL BLOG DEL BÚHO";2006;"Primera edición";"No ficción";"Escrito";" ";"Ciencias y tecnología";"España";;"Blog";;"Pero la propuesta de Xabi me hizo empezar a buscar en mi ya crecidita bibliografía de corte gastronómico y cuanto más leía más me iba interesando. Hasta el punto que he acabado comprando por Internet una monografía publicada en los Annales de Physique franceses (Ann. Phys. Fr. 27, n. 4, 2002) y que habla de la ""Physicochimie des bulles de champagne"". ¡Toma tratado científico de hondas repercusiones gastronómicas";"si";"cuanto"
"Nettel, Guadalupe: El huésped. Barcelona: Anagrama, 2006.";"Nettel, Guadalupe";"El huésped";2006;"Primera edición";"Ficción";"Escrito";"Libro";"Novela";"México";"México y Centroamérica";"Ficción";;"durante muchos años me rehusé a mirar a los ciegos. Cuando por casualidad coincidía con ellos en una calle, cambiaba de acera, con un horror semejante al que provocan los gatos negros en ciertos individuos. Eran señales de mal agüero que anunciaban la cercanía de La Cosa. Pero una ley infalible asegura que cuanto más repudiamos algo, más se aparece en nuestra vida. Así, de tanto detestarlos, comenzaron a surgir en todos lados: en el parque por el que paseaba diariamente, los consultorios que frecuentaba mi madre, el supermercado, las ferias y los centros comerciales; hasta que un día acabé acostumbrándome a su presencia";"si";"cuanto"
"Cucurto, Washington: El curandero del amor. Buenos Aires: Emecé, 2011.";"Cucurto, Washington";"El curandero del amor";2006;"Primera edición";"Ficción";"Escrito";"Libro";"Novela";"Argentina";"Río de la Plata";"Ficción";;"montada, hacia el trabajo de María. Yo me volví a casa a las cuatro de la tarde y todos, suni, baltu, more, felipe y josé, augusto y dalia, mis seis hijos, dormían la siesta. Me tiré en el sillón a escuchar Rodrigo y olvidarme de todo, pero cuanto más quiero olvidarla más pienso en ella y en ella. En estas dos atorrantas que nunca se sabe qué estarán haciendo entre las fotocopiadoras del Centro de Estudiantes de la Facultad de Sociales, que yo las amo a las dos, una de Pergamino y otra del Coto, una revolucionaria y otra voladora, una";"si";"cuanto"
"Botero, Juan Carlos: El arrecife. Barcelona: Belacqva, 2006.";"Botero, Juan Carlos";"El arrecife";2006;"Primera edición";"Ficción";"Escrito";"Libro";"Novela";"Colombia";"Caribe continental";"Ficción";;"Ahora la fuerza del agua me succionaba hacia adelante y luego me parecía escupir hacia atrás. Era difícil avanzar y más todavía mantener el control. Cuanto más pasaban los minutos más pequeño e insignificante me sentía, reducido por el incremento de la potencia que me zarandeaba. Me sentía como barrido por una escoba descomunal, con desprecio y desdén hacia la costa, pero a continuación era como si alguien me sujetara de las solapas y me atrajera hacia adelante con unas garras de hierro";"si";"cuanto"
"Beltrán, Rosa: Alta infidelidad. México D. F.: Alfaguara, 2011.";"Beltrán, Rosa";"Alta infidelidad";2006;"Primera edición";"Ficción";"Escrito";"Libro";"Novela";"México";"México y Centroamérica";"Ficción";;"Los siguientes meses los pasó entre Marcela y el recuerdo de Silvina. Y entre más pasaba el tiempo, más se convencía de que en aquel viaje había vivido algo irrepetible. Único. Y se acordaba sólo de los buenos momentos: el amor crece cuando está lejos. El deseo también, sobre todo cuando el objeto está en la imaginación. Y en la posibilidad, claro, de satisfacerlo algún";"si";"entre"
"Solares, Martín: Los minutos negros. Barcelona: Debolsillo, 2007.";"Solares, Martín";"Los minutos negros";2006;"Primera edición";"Ficción";"Escrito";"Libro";"Novela";"México";"México y Centroamérica";"Ficción";;"Se oyó un ""clic"" y Cabrera descubrió que el Chaneque apoyaba una navaja de resorte contra su panza. Mientras más intentaba esquivarla, más se clavaba en la barriga del Macetón. Cabrera sintió que palidecía: Ahí muere... ahí muere... Cuando decidió que era suficiente, Chávez guardó la navaja y se retiró. El Macetón respiró con alivio.";"si";"mientras"
"Torres, Mara: «III. La profesora de piano». Sin ti. Cuatro miradas desde la ausencia. Madrid: Aguilar, 2006.";"Torres, Mara";"Sin ti. Cuatro miradas desde la ausencia";2006;"Primera edición";"Ficción";"Escrito";"Libro";"Relato";"España";;"Ficción";;"-¿Has visto, Ale? Todo puede ser utilizado para entender la música. La música es novelar, es imaginar, es querer lo imposible. La música tiene profundidad, toda la que tú quieras o seas capaz de soñar y cuanto más sueñes más lejos vas a llegar.";"si";"cuanto"
"Martínez Alonso, María: «Cocodrilo azul». Teatro. Piezas breves. Alumnos RESAD Curso 2005/2006. Madrid: Fundamentos, 2006.";"Martínez Alonso, María";"Teatro. Piezas breves. Alumnos RESAD Curso 2005/2006";2006;"Primera edición";"Ficción";"Escrito";"Libro";"Teatro";"España";;"Ficción";;"Compañero 2.- Ten cuidado, que cuanto más gritan, más rápido piensan el nombre de los niños.";"si";"cuanto"
"Chozas, Mercedes: Las horas náufragas. Madrid: Calambur, 2006.";"Chozas, Mercedes";"Las horas náufragas";2006;"Primera edición";"Ficción";"Escrito";"Libro";"Novela";"España";;"Ficción";;"alteraban las cejas ni la frente ni la boca y que besaban sin miedo. «Pues eso no es lo más importante de envejecer. ¿Sabéis lo que significa envejecer?» Hizo una pausa larga sin separar su cara de sus caras, crecida al estar tan cerca. «Envejecer es despedirse. Cuantas más despedidas se viven, más se envejece. Cuantos más abandonos, más viejo se hace uno por dentro y por fuera. ¡Eso es envejecer!» Se levantó muy despacio, recogió los cuadros de los condenados, vació el vaso con el último trago y escupió.";"no";"cuanto"
"Medina, Elizabeth: Sampaguitas en la cordillera. Reencuentro con Filipinas en Chile. Santiago de Chile: RIL Editores, 2006.";"Medina, Elizabeth";"Sampaguitas en la cordillera. Reencuentro con Filipinas en Chile";2006;"Primera edición";"No ficción";"Escrito";"Libro";"Ciencias sociales, creencias y pensamiento";"Filipinas";"Filipinas";"Biografía memoria";;"por muchos años, ha vuelto a mí en este último tiempo, para convertirse en lo que en ese momento no sabía qué era: un mensaje de amor. Con infinita ternura tomó mi cara en sus manos y susurró: «Tu hermana es linda y más llamativa que tú a primera vista... pero mientras más miro tu rostro, más bonita te veo».";"si";"mientras"
"Nkogo Esono, Maximiliano: Nambula. Madrid: Morandi, 2006.";"Nkogo Esono, Maximiliano";"Nambula";2006;"Primera edición";"Ficción";"Escrito";"Libro";"Novela";"Guinea Ecuatorial";"Guinea Ecuatorial";"Ficción";;"aún no tiene nada concreto en la cabeza, ninguna idea sobre cómo empezar su trabajo. ¿En qué debe consistir realmente ser supervisor general encargado de misiones?, se pregunta para sus adentros. Coge un bolígrafo y empieza a garabatear una lista de funciones que cree que de verdad deben ser las suyas, pero cuantas más escribe más borra, hasta que al final rompe todo el papel y lo tira a la papelera con la rabia de haber pasado un buen tiempo sin sacar nada en limpio. Decide no volver a escribir, porque esto no es su fuerte. A partir de ahora únicamente se dedicará a pensar y nada más. Va a pensar";"si";"cuanto"
"Marín, María: «Por Dentro. ¿Reconoces a un ""Pinocho""? ». Elnuevodia.com. San Juan: elnuevodia.com, 2006-03-28.";"Marín, María";"Elnuevodia.com";2006;"Primera edición";"No ficción";"Escrito";"Prensa";"Ciencias sociales, creencias y pensamiento";"Puerto Rico";"Antillas";;;"además del mentiroso compulsivo está el que miente para salir de un aprieto, no herir sensibilidades o por el miedo a perder algo. Pero mientras más mentimos, más nos sumimos en un mundo de falsedad y verdades a medias a las que tenemos que dar seguimiento, para no ponernos al descubierto. Las mentiras pueden crecer como una enorme bola de nieve.";"si";"mientras"
"Cardona Tobón, Paola A.: «Hasta 9º habrá cobertura total». El Colombiano.com. Medellín: elcolombiano.com, 2006-10-11.";"Cardona Tobón, Paola A.";"El Colombiano.com";2006;"Primera edición";"No ficción";"Escrito";"Prensa";"Política, economía y justicia";"Colombia";"Caribe continental";;;"Una cosa que es muy importante para confrontar todo este asunto de si es cobertura o calidad es el problema de la deserción. Cuando se amplia cobertura y se hace sin calidad y un poco a la loca, crece la deserción, porque entre más ingresas, una proporción más alta se sale, pues no se hace de manera organizada.";"si";"entre"
"«La basura se renueva». El País digital. Tecno. Montevideo: elpais.com.uy/suple/tecno, 2006-09-15.";;"El País digital. Tecno";2006;"Primera edición";"No ficción";"Escrito";"Prensa";"Ciencias y tecnología";"Uruguay";"Río de la Plata";;;"7) Nunca responda a los mensajes no solicitados. La mayor parte de los spammers usan las respuestas para verificar qué direcciones son reales. Mientras más responda, más spam recibirá.";"si";"mientras"
"«Mi mundo digital. Iván de Pineda. Cada día más conectado». Clarín.com. Next. Buenos Aires: clarin.com/suplementos/informatica, 2006-09-20.";;"Clarín.com. Next";2006;"Primera edición";"No ficción";"Escrito";"Prensa";"Ciencias y tecnología";"Argentina";"Río de la Plata";;"Periodicidad: semanal";"—Hace un par de años salté al mundo Mac. Tengo una Ibook G4, la blanquita, con una pantalla de 12 pulgadas. Como trabajo mucho con fotos y programas de diseño, me parece ideal. Cuanto más aprendés, más te hacés adicto. Además, son mucho más lindas, tienen onda. Estoy chocho. La llevo siempre conmigo y uso mucho el WiFi en otros países y en los aeropuertos.";"si";"cuanto"
"Vila, Eva: «Serrat en los ojos». Nación.cl. Santiago de Chile: lanacion.cl, 2006-06-14.";"Vila, Eva";"Nación.cl";2006;"Primera edición";"No ficción";"Escrito";"Prensa";"Artes, cultura y espectáculos";"Chile";"Chilena";;;"ese ""vuélvela a tocar Sam"". Las exquisiteces de la última producción de Serrat tienen sobre sí un mal consejero, la prisa. Como los buenos, estos temas necesitan reposo y volver una vez tras otra a ellos con el poso del anterior. Y como pasa en la música que perdura, cuanto más entendemos el conjunto más entramos en cada una de sus canciones.";"si";"cuanto"
"Sotillo, Alberto: «Chiíes, amigos y enemigos». ABC.es. Madrid: abc.es, 2006-01-16.";"Sotillo, Alberto";"ABC.es";2006;"Primera edición";"No ficción";"Escrito";"Prensa";"Ciencias sociales, creencias y pensamiento";"España";;;;"en el «eje del mal». Y en éstas apareció el hirsuto Ahmanideyad, que no parece que tenga muchas posibilidades de sacar a su país de la crisis económica, pero que está dispuesto a basar su popularidad en su vocación nuclear, muy bien vista por sus conciudadanos. Como si pensara que, cuanto más saque pecho, más popular.";"si";"cuanto"
"Fuertes, Santiago F.: «FÚTBOL - 38ª jornada de Liga. Una delicia sin guinda». El País.com. Madrid: elpais.com, 2006-05-16.";"Fuertes, Santiago F.";"El País.com";2006;"Primera edición";"No ficción";"Escrito";"Prensa";"Actualidad, ocio y vida cotidiana";"España";;;;"le pida o se le exija. El juego fluye sobre un andamiaje de trabajo honrado, solidario, disciplinado y, sobre todo, confiado en sus posibilidades. Anoche ofreció un espectáculo de fútbol fabuloso. Luchó por la victoria desde el primer minuto. Y así siguió incluso cuando llevaba dos goles de desventaja supercalifragilisticuespialidoso: cuanto más jugaba, resultaba más enredoso. Durante casi todo el encuentro, su mejor jugador fue Cicinho, justo el que por orden táctica jugaba más extraviado de su posición natural.";"si";"cuanto"
"Cherny, Martín; Rulick, Sergio: Comunicación no verbal. Cómo la inteligencia emocional se expresa a través de los gestos. Buenos Aires: Granica, 2007.";"Cherny, Martín; Rulick, Sergio";"Comunicación no verbal. Cómo la inteligencia emocional se expresa a través de los gestos";2007;"Primera edición";"No ficción";"Escrito";"Libro";"Ciencias sociales, creencias y pensamiento";"Argentina";"Río de la Plata";;;"No se trata de modificar la conducta para ser de una determinada manera, sino que lo conveniente es manejar el repertorio de actos no-verbales más amplio y preciso posible. Cuanto más desarrollemos este repertorio, más adaptables seremos a los ambientes cambiantes, y más efectiva será nuestra comunicación.";"si";"cuanto"
"Cueto, Alonso: El susurro de la mujer ballena. Barcelona: Planeta, 2007.";"Cueto, Alonso";"El susurro de la mujer ballena";2007;"Primera edición";"Ficción";"Escrito";"Libro";"Novela";"Perú";"Andina";"Ficción";;"de ustedes fuera a pedirme disculpas. Quería irme, irme, irme nomás. Quería huir de allí, estar lo más lejos posible de ustedes, de ti sobre todo. Eso era lo que quería. Entonces corrí por la pista. Corría aterrada, no me cansaba, corría nomás. Mientras más corría, más ganas tenía de seguir corriendo. Así que llegué a Molicentro y luego a la Avenida Raúl Perrero. Vi a mi izquierda la figura de un inmenso gato que me pareció me iba a perseguir. Algunos carros pasaban volando a mi alrededor. Me zumbaban al costado. Por un momento pensé que habría sido";"si";"mientras"
"Valencia García, Guadalupe: Entre cronos y kairós. Las formas del tiempo sociohistórico. Barcelona: Anthropos, 2007.";"Valencia García, Guadalupe";"Entre cronos y kairós. Las formas del tiempo sociohistórico";2007;"Primera edición";"No ficción";"Escrito";"Libro";"Ciencias sociales, creencias y pensamiento";"México";"México y Centroamérica";;;"cuanto más exploramos el universo, más nos topamos con el elemento narrativo presente en todos los niveles. Es inevitable pensar en Scherezade, que sólo interrumpía una historia para empezar otra más hermosa si cabe. También la naturaleza nos presenta una serie de narraciones inscritas unas dentro de las otras: la historia cosmológica, la historia en el";"si";"cuanto"
"Fernández Díaz, Jorge: «El amor es muy puto». Corazones desatados: historias de amor de gente común. Buenos Aires: Sudamericana, 2007.";"Fernández Díaz, Jorge";"Corazones desatados: historias de amor de gente común";2007;"Primera edición";"Ficción";"Escrito";"Libro";"Relato";"Argentina";"Río de la Plata";"Ficción";;"- Cuanto más pienso en ese lector más creo que es un hombre de unos sesenta años -dijo Helena-. Es cierto el lugar común de que ya no hay hombres. Los hombres de cuarenta o están casados o quieren chicas más jóvenes. Sólo se interesan por nosotras los de sesenta para arriba, y ahora con el viagra";"si";"cuanto"
"Santis, Pablo de: El enigma de París. Buenos Aires: Planeta, 2007.";"Santis, Pablo de";"El enigma de París";2007;"Primera edición";"Ficción";"Escrito";"Libro";"Novela";"Argentina";"Río de la Plata";"Ficción";;"Cuanto más avanzábamos, más nos convencíamos de que nuestro falso hindú, de nacionalidad belga, era culpable, y si no lo habían atrapado era porque había elegido siempre víctimas sin importancia, hijas de inmigrantes, muchachas solas a las que nadie reclamaba.";"si";"cuanto"
"Santis, Pablo de: El enigma de París. Buenos Aires: Planeta, 2007.";"Santis, Pablo de";"El enigma de París";2007;"Primera edición";"Ficción";"Escrito";"Libro";"Novela";"Argentina";"Río de la Plata";"Ficción";;", o las dificultades de los ascensores para subir en diagonal. En sus declaraciones a la prensa, Eiffel se mostraba más seguro ante los problemas de ingeniería que ante sus enemigos: la torre había sido atacada por políticos y por intelectuales, por artistas y por miembros de sectas esotéricas. Pero algo era seguro: cuanto más crecía la torre, más se alejaba de los problemas. Ahora que estaba casi terminada, las voces que se le oponían ya no sonaban con la furia que es afín a la acción, sino con la nostalgia por un mundo perdido. Con los problemas gremiales había ocurrido lo mismo. Era más difícil trabajar a trescientos metros";"si";"cuanto"
"Santis, Pablo de: El enigma de París. Buenos Aires: Planeta, 2007.";"Santis, Pablo de";"El enigma de París";2007;"Primera edición";"Ficción";"Escrito";"Libro";"Novela";"Argentina";"Río de la Plata";"Ficción";;"Me cansé de la espera y salí a buscarlo. Recorrí las tabernas que el detective frecuentaba, busqué informantes que me hablaban de otros lugares más secretos; dejé los terrenos del pernod para entrar en los fumaderos de opio. Cuanto más preguntaba, más lejano me parecía Arzaky; no me inquietaba la ausencia de pistas sino su abundancia. Arzaky discutió con un húngaro, Arzaky golpeó a una mujer, Arzaky le arrancó el puñal a un cocinero chino, esa sombra en la pared es la sombra de Arzaky. Un ciego, intoxicado de opio, abrió";"si";"cuanto"
"Zúñiga, Antonio: Rompe-cabeza. México D.F.: Paso de gato, 2007.";"Zúñiga, Antonio";"Rompe-cabeza";2007;"Primera edición";"Ficción";"Escrito";"Libro";"Teatro";"México";"México y Centroamérica";"Ficción";;"Lupita: Qué tonta, de verdad. Pero así es la ambición. Entre más tienes más quieres. ¡Qué tonta fuiste mujer!";"si";"entre"
"López, Juancarlos: «Las hormigas de Ovidio». Bestiario de caricias. Viejo San Juan: Terranova, 2007.";"López, Juancarlos";"Bestiario de caricias";2007;"Primera edición";"Ficción";"Escrito";"Libro";"Relato";"Puerto Rico";"Antillas";"Ficción";;"-Como te dije el niño fue a ocultarse dentro de la corteza de un árbol hasta el otro día. Con un sol brillante, caminó por toda la creación a medio construir. Él vio nuevas cosas que no eran montañas y se asombró. Mientras más caminaba, más descubría, pero sus pasos le llevaron a la casa de Dios. La curiosidad se adueñó de su corazón y entró. Para este entonces, ya Dios había contado todas las razas y sabía que faltaba un niño sin nombre. Entonces ordenó al resto de los niños su búsqueda. Fueron seis noches";"si";"mientras"
"Pauls, Alan: Historia del llanto: Un testimonio. Barcelona: Anagrama, 2007.";"Pauls, Alan";"Historia del llanto: Un testimonio";2007;"Primera edición";"Ficción";"Escrito";"Libro";"Novela";"Argentina";"Río de la Plata";"Ficción";;"de creer que la felicidad es lo que se opone al dolor, lo que se da el lujo de ignorarlo, lo que puede vivir sin él. Así que cuando su padre, hablando de él ante un amigo, menciona su famosa sensibilidad y pone los ojos en blanco, en un trance extático que cuanto más parece elevarlo más aplasta a quien se lo causa, más lo hunde en el abatimiento, quizás haría mejor en decirlo todo y hablar de lo que está realmente en juego: una sensibilidad que sólo tiene ojos para el dolor y es absoluta, irreparablemente ciega a todo lo que no sea dolor.";"si";"cuanto"
"Rivadeneira Prada, Raúl: «Un día de julio». Tiempo de ficción. La Paz: Ediciones Signo, 2007.";"Rivadeneira Prada, Raúl";"Tiempo de ficción";2007;"Primera edición";"Ficción";"Escrito";"Libro";"Relato";"Bolivia";"Andina";"Ficción";;"La parte alta de la colina comenzó a extenderse hasta formar una inmensa meseta que cuanto más corrían los fugitivos, más se alargaba. Facundo volvía la vista de rato en rato por encima del hombro y comprobaba que los soldados se aproximaban peligrosamente y ahora sí entendía sus gritos: ""¡Alto, carajo!"" ¡Alto! Se detuvo en seco, agitado y encaró a sus perseguidores:";"si";"cuanto"
"Rivadeneira Prada, Raúl: «Timoteo Veremundo». Tiempo de ficción. La Paz: Ediciones Signo, 2007.";"Rivadeneira Prada, Raúl";"Tiempo de ficción";2007;"Primera edición";"Ficción";"Escrito";"Libro";"Relato";"Bolivia";"Andina";"Ficción";;"le correspondía el número uno. Más aún: el apellido Abastosolo sugiere que es una persona única, singular, equivalente a ""Me basto solo"". La casualidad hizo que su primero y único taller estuviera marcado con el número 111. Por si fuera poco, su cédula de identidad lleva el número 11.111. Cuanto más ataba cabos, más creía en que esto no podía ser fruto de la mera casualidad. El ministro seguía perorando. Había pasado de la exaltación de las virtudes ciudadanas encarnadas en don Régulo al elogio desmedido de la política de bienestar social del Gobierno y leía una larga lista de obras, muchas inventadas, que";"si";"cuanto"
"Robledo, Jorge Enrique: «La globalización neoliberal niega la democracia». Hoyos Vásquez, Guillermo: Filosofía y teorías políticas entre la crítica y la utopía. Buenos Aires: Consejo Latinoamericano de Ciencias Sociales, 2007.";"Hoyos Vásquez, Guillermo";"Filosofía y teorías políticas entre la crítica y la utopía";2007;"Primera edición";"No ficción";"Escrito";"Libro";"Política, economía y justicia";"Colombia";"Caribe continental";;;"desigualdad mayor que esa supuesta igualdad que están concediendo. Se ha puesto en marcha una política pensional, de educación y de salud terriblemente antisocial. En el caso de la salud, se la convierte en una mercancía. Todos sabemos que la mercancía, cuando es de alto costo, es de excelente calidad. No obstante, cuanto más baje el costo, más mediocre será la calidad, hasta terminar desapareciendo en la escala inferior de la estratificación social, que es lo que le sucede a la mitad de los colombianos que no tienen ningún derecho en salud.";"si";"cuanto"
"Ruy Sánchez, Alberto: La mano del fuego. Un Kama Sutra involuntario. Madrid: Alfaguara, 2008.";"Ruy Sánchez, Alberto";"La mano del fuego. Un Kama Sutra involuntario";2007;"Primera edición";"Ficción";"Escrito";"Libro";"Novela";"México";"México y Centroamérica";"Ficción";;"Aunque ya sería tiempo de que lo averiguara. Veinte años siendo editor de la revista erótica El Jardín Perfumado, especie de Playboy más cosmopolita (menos rubias y más costumbres eróticas de otros pueblos), llevan a la gente equívocamente a pensar que soy un especialista en esos temas. Pero, si soy sincero, entre más pasa el tiempo y más cosas me suceden menos sé del asunto. Más ridículo me siento y menos idílicamente erótico. Tal vez el erotismo y la pasión siempre son ridículos. Y por un instante magnífico nos engañamos pensando que son sublimes.";"no";"entre"
"Uribe, Álvaro: Expediente del atentado. México, D.F.: Tusquets, 2007.";"Uribe, Álvaro";"Expediente del atentado";2007;"Primera edición";"Ficción";"Escrito";"Libro";"Novela";"México";"México y Centroamérica";"Ficción";;"Les juro por Dios Santo que entre más bebía mi hijo, más sobrio se ponía. Y también más serio. Y con esa seriedad tan rara decía cosas muy bien dichas, aunque yo en ese momento no las entendiera bien. Decía que ya había llegado la hora. Que pronto acabaría todo. Que él ya no iba a ver cómo volvía a comenzar";"si";"entre"
"Gallego, Carlos Mario: La era Uribe contada por las dos lengüilargas de Colombia. Buenos Aires: Aguilar, 2007.";"Gallego, Carlos Mario";"La era Uribe contada por las dos lengüilargas de Colombia";2007;"Primera edición";"No ficción";"Escrito";"Libro";"Actualidad, ocio y vida cotidiana";"Colombia";"Caribe continental";;;"-Oites Tola, mientras más pienso más injusto me parece Uribe con Pastrana... Es que no todo fue malo en el cuatreño de Andrés. Vea: llevó la televisión al Caguán. detrás de él, pero la llevó.";"si";"mientras"
