"BIBLIOGRAFIA";"AUTOR";"TITULO";"FECHA";"CRITERIO";"BLOQUE";"MEDIO";"SOPORTE";"TEMA";"PAIS";"ZONA";"TIPOLOGIA";"NOTAS";"CONCORDANCIA";"Valida"
"Rey, Alberto: «Látex, peluquerías y extraterrestres». Asesino en serie. http://www.elmundo.es/blogs/elmundo/asesinoenserie/: www.elmundo.es/blogs/elmundo/asesinoenserie, 2013-11-12.";"Rey, Alberto";"Asesino en serie";2013;"Fecha de escritura";"No ficción";"Escrito";" ";"Artes, cultura y espectáculos";"España";;"Blog";;") y los suyos siguen sorprendiéndonos episodio tras episodio. ¿El hombre de látex de la primera temporada? Superado. ¿La aparición ""estelar"" de Anna Frank en la segunda? Superada. Y así muchas cosas. Como ya he dicho alguna vez aquí, 'American Horror Story' es la serie del más es más, del nunca es suficiente y del pase, pase, que al final hay sitio. Sitio para otro personaje más, otra trama delirante más o, mejor todavía, otro momento incoherente más que, al final, resulta ser de lo más coherente. Recordad el numerito musical de la segunda temporada";"no"
"Malacalza, Leonardo (...) [et al.]: «Capítulo IX: Los recursos naturales». Malacalza, Leonardo (ed.): Ecología y ambiente. La Plata: Asociación de Universidades Grupo Montevideo, Universidad Nacional de La Plata, 2013.";"Malacalza, Leonardo (ed.)";"Ecología y ambiente";2013;"Primera edición";"No ficción";"Escrito";"Libro";"Ciencias y tecnología";"Argentina";"Río de la Plata";"Académico";;"neutro desde el punto de vista ambiental, ni que el mentado “contacto con la naturaleza” sea el éxtasis místico de encuentro con Gea, la diosa de la Tierra que su nombre invoca. Es una importante actividad económica — cada vez más importante, aún para países como el nuestro, tan alejado geográficamente de las zonas más pobladas y más afluyentes. Y es un cambio temporáneo de hábitat de los que pueden costearlo.";"no"
"Paenza, Adrián: Matemagia. Buenos Aires: Sudamericana, 2013.";"Paenza, Adrián";"Matemagia";2013;"Primera edición";"No ficción";"Escrito";"Libro";"Ciencias y tecnología";"Argentina";"Río de la Plata";"Divulgación";;"a medida que uno va acumulando experiencia, es cada vez más difícil encontrarse con situaciones que se corran de lo común, o en todo caso, de lo que se va haciendo cada vez más común. La probabilidad de sorprenderse disminuye con el tiempo vivido, aunque más no sea porque es una consecuencia natural: uno más vive, más cosas conoce, más acostumbrado está al mundo que lo rodea, más puede predecir lo que se avecina, y por lo tanto, es cada vez menos probable que aparezca algo que uno no haya imaginado o visto. De eso quiero hablar acá. Es que la matemática provee sorpresas que 'atentan contra la";"si"
"Martínez Siccardi, Fabián: Bestias afuera. Buenos Aires: Arte Gráfico Editorial Argentino, 2013.";"Martínez Siccardi, Fabián";"Bestias afuera";2013;"Primera edición";"Ficción";"Escrito";"Libro";"Novela";"Argentina";"Río de la Plata";"Ficción";;"ese instante. Dijo que no hacía falta volver a vendar, que las heridas se habían secado bastante, que sería mejor dejar que se absorbiera el ungüento y terminaran de curarse al aire. ¿Y si había provocado mi excitación a sabiendas? ¿Si estaba jugando conmigo? Cuanto más hermética se tornaba, más desconfiaba de ella y más me excitaba.";"no"
"Antin, Eduardo; Rosberg, Andrés: Más allá del Malbec. Conversaciones sobre vinos sin dogmas. Buenos Aires: Sudamericana, 2013.";"Antin, Eduardo; Rosberg, Andrés";"Más allá del Malbec. Conversaciones sobre vinos sin dogmas";2013;"Primera edición";"No ficción";"Escrito";"Libro";"Actualidad, ocio y vida cotidiana";"Argentina";"Río de la Plata";"Divulgación";"El texto fuente contiene citas ajenas a los autores.";"Q. En materia de cine, tengo la impresión de que uno empieza a comprender bien su universo cuando puede localizar las tensiones entre estilos, películas, directores, épocas. Cuando se identifican —incluso tomando partido— las tendencias en pugna, las polémicas esenciales. En el vino, creo que esas polémicas están más escondidas, se trata más bien de comentarios a puertas cerradas. No hablo de chismes ni de secretos industriales, sino de cierto material que constituye la conversación entre especialistas, que no es necesariamente aquello que trasciende al gran público. Por ejemplo, una de las cosas más fascinantes que me tocó leer últimamente es la";"no"
"Serrano, Marcela: «Misiones». Dulce enemiga mía. Veinte relatos. Buenos Aires: Alfaguara, 2013.";"Serrano, Marcela";"Dulce enemiga mía. Veinte relatos";2013;"Primera edición";"Ficción";"Escrito";"Libro";"Relato";"Chile";"Chilena";"Ficción";;"de Santiago de Chile, Mohamed nunca ha soltado su bolso. Es un maletín rectangular verde oscuro que imita el cuero y que me recuerda a los antiguos James Bond que caracterizaban el equipaje de los ejecutivos. Ni qué decir, a éste, el que Mohamed acaricia y aprisiona, no le pondríamos tal etiqueta, es más informe, más ajado, más barato y feo que los de entonces.";"no"
"Cea Aránguiz, Rodrigo; Montalva Wainer, Sebastián: Los 10 mejores trekkings en Torres del Paine. Santiago de Chile: El Mercurio. Aguilar, 2013.";"Cea Aránguiz, Rodrigo; Montalva Wainer, Sebastián";"Los 10 mejores trekkings en Torres del Paine";2013;"Primera edición";"No ficción";"Escrito";"Libro";"Actualidad, ocio y vida cotidiana";"Chile";"Chilena";"Libro de texto";"Algunas imágenes que aparecían entre párrafos contenían texto que se ha situado entre ellos debidamente codificado";"En zigzag, en unos quince minutos más debiera llegarse a lo más alto del montículo: el mirador Cóndor. Desde esta plataforma se puede apreciar la magnitud del parque, cuyos límites se pierden a simple vista; y también los patentes efectos de los últimos incendios forestales, que han dejado yermas enormes extensiones de terreno.";"no"
"Embid, Julio [coord.]: Informe sobre la democracia en España 2013: Un gran salto hacia atrás. Madrid: Fundación Alternativas, 2013.";"Embid, Julio [coord.]";"Informe sobre la democracia en España 2013: Un gran salto hacia atrás";2013;"Primera edición";"No ficción";"Escrito";"Libro";"Política, economía y justicia";"España";;"Divulgación";;"l poder en diciembre de 2011, el nuevo Gobierno del PP intensificó las políticas de austeridad, aunque las equilibró, igual que la mayoría de los socios europeos, hacia un mayor peso de las medidas recaudatorias. Así y todo, la mayor parte del ajuste siguió recayendo en las reducciones de gastos, que cada vez más afectaron a partidas socialmente más sensibles.";"no"
"Chirbes, Rafael: En la orilla. Barcelona: Anagrama, 2013.";"Chirbes, Rafael";"En la orilla";2013;"Primera edición";"Ficción";"Escrito";"Libro";"Novela";"España";;"Ficción";;", una familia. Añoro, sobre todo, que las cosas no hayan sido distintas para mí, no esta provisionalidad que se alarga y dura decenios y, cuando te das cuenta, la vida se está acabando, y las cosas no han ido nunca por donde uno había previsto, no se dejan controlar, qué más querría yo, qué más hubiera querido. Son sus ojos, es el brillo de sus ojos lo que veo en el destello del sol. Tus ojos, Álvaro. El pájaro ha ido haciéndose más pequeño confundiéndose con esos destellos del sol en el cielo. El brillo de los ojos, una";"no"
"Coto Montero, Margarita: Síndrome de Asperger: Guía práctica para la intervención en el ámbito escolar. Sevilla: Asociación Sevillana de Síndrome de Asperger, 2013.";"Coto Montero, Margarita";"Síndrome de Asperger: Guía práctica para la intervención en el ámbito escolar";2013;"Primera edición";"No ficción";"Escrito";"Libro";"Salud";"España";;"Divulgación";;"2. Órdenes sencillas y claras en cada enunciado. Debemos tener cuidado con las órdenes que damos por supuestas. Hay una norma no escrita en cuanto a exámenes según la cual, más vale poner información de más que de menos. Esto las personas con SA no lo conocen. Por tanto responderán escuetamente a la orden que le damos. Por ejemplo, si pedimos que enumeren, solo enumerarán. No podemos después penalizarles porque además de enumerar no han definido los elementos de la lista.";"no"
"Abascal, Naty; Gallart, Vicente: 100% Naty. Manual de estilo de Naty Abascal con Vicente Gallart. Barcelona: Grijalbo, 2013.";"Abascal, Naty; Gallart, Vicente";"100% Naty. Manual de estilo de Naty Abascal con Vicente Gallart";2013;"Primera edición";"No ficción";"Escrito";"Libro";"Actualidad, ocio y vida cotidiana";"España";;"Varios";;"Cuando busco ejemplos de mujeres excesivas en el pasado, únicamente nombres como Peggy Guggenheim, Iris Apfel o Anna Piaggi merecen mi respeto. Su compromiso con el lema «more is more», o más es más, era absoluto y tenía unas connotaciones artísticas de gran profundidad. Ellas se podían permitir ponerse todo encima y estar divinas, porque su gran personalidad las arropaba.";"no"
"Mañas, Jose Ángel; Domínguez Leiva, Antonio: «La fuga del Abuela». Escudero Abenza, Pablo ... [et al.]: Tiempo de relatos. Barcelona: Planeta, 2013.";"Escudero Abenza, Pablo ... [et al.]";"Tiempo de relatos";2013;"Primera edición";"Ficción";"Escrito";"Libro";"Relato";"España";;"Ficción";;". Había quien se hacía ilusiones de que, si seguía así, los jóvenes acabarían asaltando las cárceles. Otros temían que las manifestaciones provocaran una reacción violenta por parte de la casta política, puesta en evidencia o, como ellos decían en su colorida jerga, «dejada con el culo al aire». Los más pensaban que era más de lo mismo, otra cagada de un pueblo avasallado que dejó morir a su dictador en la cama.«Perro ladrador poco mordedor», resumían lacónicamente.";"no"
"Etxebarría Asteinza, Lucía: Tu corazón no está bien de la cabeza: cómo salí de una relación tóxica. s. l.: Marcellinux, 2013.";"Etxebarría Asteinza, Lucía";"Tu corazón no está bien de la cabeza: cómo salí de una relación tóxica";2013;"Primera edición";"No ficción";"Escrito";"Libro";"Ciencias sociales, creencias y pensamiento";"España";;"Divulgación";"Contiene apuntes de los psicólogos Alfred Martínez y Eva Cornudella";"EVA CORNUDELLA. En mediación observamos quién habla más, quién se exalta más. El que más habla suele exponerse más y estar más preocupado por la relación. El silencio en ocasiones es indicativo de poder y manipulación. Normalmente cuando se habla tras un largo silencio, el que ha callado ha quitado poder al otro durante este tiempo de silencio, y el otro se siente realmente débil e «histérico»";"no"
"bibliotecaBNE: Palabra de arquitecto: el ámbito digital, ¿un nuevo espacio para la crítica arquitectónica?. ";"bibliotecaBNE";"Palabra de arquitecto: el ámbito digital, ¿un nuevo espacio para la crítica arquitectónica?";2013;"Fecha de emisión";" ";"Oral";" ";;"España";;"Tertulia";;"o faltan como cuatro horas / ¿no? / esa es una cosa también / eeh inevitable / eeh la verdad que el acercamiento al // como al mundo digital / eeh propio así como arquitecto / eeh reconozco que / ni más ni menos viene de mano de la docencia // eeh hubo un momento que // eeh te das cuenta que los alumnos en clase estabais más / estaban más / eeh pendientes de lo que estaba pasando con el teléfono móvil que de lo que decía el profesor // y y claro / cualquier docente que tiene esa preocupación de saber qué le interesa a los alumnos / llega un momento que tiene que decir // si no te atienden / a ti / por lo menos que atiendan lo que están viendo en el teléfono";"no"
"bibliotecaBNE: Palabra de arquitecto: el ámbito digital, ¿un nuevo espacio para la crítica arquitectónica?. ";"bibliotecaBNE";"Palabra de arquitecto: el ámbito digital, ¿un nuevo espacio para la crítica arquitectónica?";2013;"Fecha de emisión";" ";"Oral";" ";;"España";;"Tertulia";;"tanto como mmm eeh información sobre personajes / información sobre obras / información sobre problemas / bueno / información pro- sobre problemas en la arquitectura / sale de la sección de cultura y va automáticamente a la sección de sociedad / porque en cultura los problemas que tratamos / suelen ser otros aunque / como le comentaba antes a Aurora cada vez está más complicado esto / y más / hay más problemas y menos cultura en la propia sección de cultura";"no"
"bibliotecaBNE: Palabra de arquitecto: el ámbito digital, ¿un nuevo espacio para la crítica arquitectónica?. ";"bibliotecaBNE";"Palabra de arquitecto: el ámbito digital, ¿un nuevo espacio para la crítica arquitectónica?";2013;"Fecha de emisión";" ";"Oral";" ";;"España";;"Tertulia";;"eso creo que ade- voy a intentar rematar como Juan / por eso creo que // cómo se refleja eso en las redes / tiene mucho que ver con las dos cosas / con la construcción del nuevo relato / con la destrucción del anterior / y / con profundizar en él para asentar las bases para uno nuevo / es verdad que hay mucho más / hay muchos más blogs que cuentan cosas que / que están sucediendo / que aquellos blogs que hacen crítica sobre las cosas que están pasando / o profundizan en ellas / por eso también aparecen tantas palabras / que a veces se utilizan como sinónimos y no lo son / o aparecen palabras nuevas / por la imposibilidad de / hablar con la misma de los matices que";"no"
"La Saga: LA ENTREVISTA POR ADELA 13 DE JUNIO 2013 OSCAR DE LA RENTA okok. ";"La Saga";"LA ENTREVISTA POR ADELA 13 DE JUNIO 2013 OSCAR DE LA RENTA okok";2013;"Fecha de emisión";" ";"Oral";" ";;"República Dominicana";"Antillas";"Entrevista";;"sí yo s- yo creo que en realidad // ah por ejemplo // yo creo y quizás esté completamente equivocado // que yo soy / muchísimo mejor diseñador / hoy // que hace cuarenta años porque he aprendido más sé más / he visto más // ah y cada día / aprendo algo nuevo eeh yo / encuentro que la palabra que más envejece es // retirarse // qué horror // retirarse ¿a dónde? / y ¿por qué? para mí / es un privilegio inmenso hacer lo que yo hago";"no"
"La Saga: LA ENTREVISTA POR ADELA 13 DE JUNIO 2013 OSCAR DE LA RENTA okok. ";"La Saga";"LA ENTREVISTA POR ADELA 13 DE JUNIO 2013 OSCAR DE LA RENTA okok";2013;"Fecha de emisión";" ";"Oral";" ";;"República Dominicana";"Antillas";"Entrevista";;"sí yo s- yo creo que en realidad // ah por ejemplo // yo creo y quizás esté completamente equivocado // que yo soy / muchísimo mejor diseñador / hoy // que hace cuarenta años porque he aprendido más sé más / he visto más // ah y cada día / aprendo algo nuevo eeh yo / encuentro que la palabra que más envejece es // retirarse // qué horror // retirarse ¿a dónde? / y ¿por qué? para mí / es un privilegio inmenso hacer lo que yo hago";"no"
"Así lo Fabrican ASF: Cómo se ""fabrica"" la leche. ";"Así lo Fabrican ASF";"Cómo se ""fabrica"" la leche";2013;"Fecha de emisión";" ";"Oral";" ";;"España";;"Otros";;"sí / contra más coman más transforman es así / si no comen no pueden producir leche / y luego una vaca de estas beberá / ciento ochenta litros de agua igual ¿eh?";"no"
"Dieta Garaulet: Consejos sobre nutrición de la mano de Marta Garaulet en Saber Vivir de La Mañana de La 1. ";"Dieta Garaulet";"Consejos sobre nutrición de la mano de Marta Garaulet en Saber Vivir de La Mañana de La 1";2013;"Fecha de emisión";" ";"Oral";" ";;"España";;"Tertulia";;"se me quedaba mejor todo asimilaba mucho más / rendía mucho más ¿no? por la noche";"no"
"Luisito Comunica: Gente Opina sobre PEÑA NIETO. ";"Luisito Comunica";"Gente Opina sobre PEÑA NIETO";2013;"Fecha de emisión";" ";"Oral";" ";;"México";"México y Centroamérica";"Entrevista";;"debería de informarse más debería de / así echarle más coco";"no"
"Marrero-Zaldívar, José Reinaldo; Frías-Arévalo, Amalia Patria: «Precedentes socio-culturales en la singular modernidad del pensamiento estético de José Martí». Ciencias Holguín. Holguín: Ciencias Holguín.cu, 2013-01-01.";"Marrero-Zaldívar, José Reinaldo; Frías-Arévalo, Amalia Patria";"Ciencias Holguín";2013;"Primera edición";"No ficción";"Escrito";"Prensa";"Ciencias sociales, creencias y pensamiento";"Cuba";"Antillas";"Académico";"Periodicidad: trimestral";"privilegiado la libertad de su patria. ""El y Whitman son, acaso, en aquellos días del 80 los más altos símbolos de humanidad de ambas Américas, con la diferencia que existe entre el mensaje naturalista del robusto patriarca nórdico, nuevo dios Thor alzado contra toda hipocresía y convención puritana, y el evangelio más intimo y espiritualizado— más para la conciencia que para el cuerpo del hombre; más asido a la otra ley universal del sufrimiento del joven apóstol de Cuba"".";"no"
"Sapag, Roberto: «La cruzada de Swett Jr.». Capital. Santiago de Chile: Capital.cl, 2013-03-08.";"Sapag, Roberto";"Capital";2013;"Primera edición";"No ficción";"Escrito";"Prensa";"Política, economía y justicia";"Chile";"Chilena";"Entrevista";"Periodicidad: bimensual";". Y por qué, porque nos dimos cuenta que el flujo de caja era negativo. Era una compañía que no generaba caja. Somos muy financieros para evaluar las compañías y ahí el balance era raro, porque los inventarios te los financiaban los proveedores y las cuentas por cobrar los bonos. Y en definitiva cada vez que vendías más necesitabas endeudarte más. Pero yendo al fondo de la pregunta, creemos que las empresas tienen que revolucionar de acuerdo con los mercados. En esa época vimos que un alto porcentaje de la población pertenecía a los segmentos C y eran muy relevantes en vestuario y calzado, y el acceso estaba limitado si no tenías tarjeta""";"no"
"«Auge de juegos móviles en Finlandia». El Universal. Cartagena: eluniversal.com.co, 2013-11-14.";;"El Universal";2013;"Primera edición";"No ficción";"Escrito";"Prensa";"Ciencias y tecnología";"Colombia";"Caribe continental";"Noticia";;"Uno de los creadores finlandeses de juegos más mencionados es Supercell, que creó ""Clash of Clans"" y ""Hay Day"", las aplicaciones más vendidas para Apple en más de 100 países.";"no"
"Silva, Victoria; Navarrete, Camila: «Las principales diferencias programáticas de los candidatos». La Tercera. Santiago de Chile: latercera.com/noticia/las-principales-diferencias-programaticas-de-los-candidatos/, 2013-11-03.";"Silva, Victoria; Navarrete, Camila";"La Tercera";2013;"Primera edición";"No ficción";"Escrito";"Prensa";"Política, economía y justicia";"Chile";"Chilena";"Noticia";;"Elevar impuesto a las empresas, llegando a un 25% en cuatro años, avanzar en equidad tributaria (quien gana más aporta más), evitar evasión y eliminar el FUT al cuarto año de gobierno.";"no"
"«Español, tercer idioma en la red y segundo en Twitter». El Universal online. Ciudad de México: eluniversal.com.mx, 2013-01-15.";;"El Universal online";2013;"Primera edición";"No ficción";"Escrito";"Prensa";"Ciencias sociales, creencias y pensamiento";"México";"México y Centroamérica";"Noticia";;"También en la red social Facebook el español es una de las lenguas más empleadas, con más de 80 millones de usuarios.";"no"
"Hernández, Bernardo: «Y de pronto, ¡una mancha!». El Universal. México, D. F.: eluniversal.com.mx, 2013-08-11.";"Hernández, Bernardo";"El Universal";2013;"Primera edición";"No ficción";"Escrito";"Prensa";"Actualidad, ocio y vida cotidiana";"México";"México y Centroamérica";"Opinión";;"En su novela Hot Sur (Planeta, 2012), Laura Restrepo pone en voz de su personaje Cleve Rose las siguientes palabras: ""[...] porque, ¡oh paradoja!, cuanto más ensuciamos más poseemos, y cuanto más poseemos más ensuciamos, y como dice Michel Serres, lo que está limpio no es de nadie. Hagan de cuenta un cuarto de hotel que espera vacío entre huésped y huésped, recién arreglado y desinfectado por las camareras y que sólo se convertirá en la habitación 15-03 del señor Fulano, o";"no"
"«Usuarios de Samsung Galaxy SIII denuncian aumento en casos de muerte súbita del aparato». La Tercera. Santiago de Chile: latercera.com, 2013-01-11.";;"La Tercera";2013;"Primera edición";"No ficción";"Escrito";"Prensa";"Ciencias y tecnología";"Chile";"Chilena";"Noticia";;"A pesar de ser uno de los smartphones más vendidos con más de 30 millones de unidades vendidas, hasta hace muy poco se está comenzando a conocer de un número desconocido pero no despreciable de usuarios de Samsung Galaxy SIII que han manifestado a través de foros en internet su descontento debido a que el smartphone se está ""muriendo"" sin motivo aparente.";"no"
"Domínguez Cruz, Ana María: «¿Un perfume solo mío?». Juventud Rebelde. La Habana: juventudrebelde.cu/cultura/2013-11-08/un-perfume-solo-mio, 2013-11-08.";"Domínguez Cruz, Ana María";"Juventud Rebelde";2013;"Primera edición";"No ficción";"Escrito";"Prensa";"Actualidad, ocio y vida cotidiana";"Cuba";"Antillas";"Entrevista";;"Los perfumes femeninos Alicia y Mariposa, los masculinos Nao y Vegueros y las dos vertientes de Coral Negro, todos de la empresa Suchel Camacho S.A. gozan hoy de prestigio internacional y son de los más vendidos, luego de más de una década de su creación.";"no"
"Batista, Julio: «¿José Antonio…? Dando Guerra». Trabajadores. La Habana: trabajadores.cu/20131020/jose-antonio-dando-guerra/, 2013-10-20.";"Batista, Julio";"Trabajadores";2013;"Primera edición";"No ficción";"Escrito";"Prensa";"Actualidad, ocio y vida cotidiana";"Cuba";"Antillas";"Entrevista";;"Hoy me siento bien y mucha gente insistió en que me quedara, pero te confieso: estoy cansado. 26 años se dicen fácil, mas pesan cada vez más y tengo miedo a no rendir al nivel acostumbrado.";"no"
"«Sony deja de fabricar la PlayStation 2». ABC. Madrid: abc.es, 2013-01-02.";;"ABC";2013;"Primera edición";"No ficción";"Escrito";"Prensa";"Ciencias y tecnología";"España";;"Noticia";;"La consola fue lanzada hace casi 13 años y se coronó como una de las consolas más vendidas, con más de 150 millones de unidades";"no"
"«Los 24 millones de virus que han amenazado nuestro ordenador en 2012». ABC. Madrid: abc.es, 2013-01-02.";;"ABC";2013;"Primera edición";"No ficción";"Escrito";"Prensa";"Ciencias y tecnología";"España";;"Noticia";;"el «malware» (software malicioso), ha publicado su «Anecdotario vírico 2012». Este año, con más de 24 millones de nuevos ejemplares de virus, han tenido muy difícil la selección de los más llamativos. «Como siempre decimos, no sólo se trata de una lista de las amenazas informáticas que más han infectado, que más se han distribuido o cuyas variantes han atacado los PCs del usuario. Son aquéllos que nos han llamado la atención por una u otra característica», explica el laboratorio. A continuación destacamos los virus que PandaLabs recoge en su «ranking» para este año:";"no"
"Ramírez, Victoriano ... [et al.]: «Aplicación de escaños compensatorios para una representación justa de los partidos». Revista Española de Ciencia Política. Madrid: recyt.fecyt.es/index.php/recp, 2013-07.";"Ramírez, Victoriano ... [et al.]";"Revista Española de Ciencia Política";2013;"Primera edición";"No ficción";"Escrito";"Prensa";"Política, economía y justicia";"España";;"Académico";"Periodicidad: cuatrimestral";"2011, con lo cual el PP aumenta en 11 escaños su representación en Madrid, 2 en Barcelona, 4 en Valencia, 1 en Alicante, 2 en Sevilla y 1 en Vizcaya, La Coruña, Asturias, Pontevedra y Córdoba. Realizando el mismo proceso para distribuir los escaños compensatorios de todos los partidos, las provincias más pobladas son las que más escaños compensatorios reciben, y los resultados finales para las circunscripciones son los que aparecen en la tabla 9.";"no"
"Quijada, Pilar: «El 90% de las rodillas se operan con poca experiencia». ABC. Madrid: abc.es, 2013-12-03.";"Quijada, Pilar";"ABC";2013;"Primera edición";"No ficción";"Escrito";"Prensa";"Salud";"España";;"Entrevista";;"— No, es muy frecuente en actividades que implican cambio de dirección, de pivote, como el esquí. Ahora en plena temporada, llega mucha gente con este problema. Es más frecuente en la mujer por motivos anatómicos, la rodilla es más valga y la hace más propensa. También tiene un poco más estrecha la escotadura por donde pasa el ligamento. Además influyen factores hormonales: justo antes de la menstruación se liberan hormonas que aumentan la elasticidad y hacen más probable la rotura.";"no"
"«País Vasco y Cataluña arrancan el año redoblando la apuesta soberanista». El País. Madrid: Elpais.com, 2013-01-02.";;"El País";2013;"Primera edición";"No ficción";"Escrito";"Prensa";"Política, economía y justicia";"España";;"Reportaje";;"Ambos han coincidido al defender un futuro diferente para sus comunidades, basado en la consulta democrática. Aunque, lógicamente, el discurso de Mas es más claro en este sentido, puesto que ya lanzó durante la campaña electoral de las pasadas autonómicas el órdago de una consulta sobre la independencia. ""Una mayoría de catalanes quiere construir un país nuevo. Arraigado a la tierra milenaria, pero mirando hacia arriba"", dijo Mas en el discurso televisado.";"no"
"@AnitaBotwin. https://twitter.com/anitabotwin: 2014-02-03.";;"@AnitaBotwin";2014;"Fecha de escritura";"No ficción";"Escrito";" ";"Actualidad, ocio y vida cotidiana";"España";;"Mensaje en redes sociales";;"@gerardotc creo que si folláramos más dormiríamos más. Y esto vale para Andalucía también.";"no"
