"BIBLIOGRAFIA";"AUTOR";"TITULO";"FECHA";"CRITERIO";"BLOQUE";"MEDIO";"SOPORTE";"TEMA";"PAIS";"ZONA";"TIPOLOGIA";"NOTAS";"CONCORDANCIA";"Valida";"cuantificador"
"Aridjis, Homero: La zona del silencio. México D. F.: Punto de Lectura, 2005.";"Aridjis, Homero";"La zona del silencio";2001;"Primera edición";"Ficción";"Escrito";"Libro";"Novela";"México";"México y Centroamérica";"Ficción";;"Entre más dure la lluvia más tiempo tendré para besarte. Quiero un trago.";"si";"entre"
"Rosenzwit, Walter: Nadar en tierra. Buenos Aires: celcit.org.ar, 2013-02-27.";"Rosenzwit, Walter";"Nadar en tierra";2001;"Fecha de estreno";"Ficción";"Escrito";"Libro";"Teatro";"Argentina";"Río de la Plata";"Ficción";"Fecha de publicación: fecha de descarga del texto fuente";"Si, con tan sólo mirar este cielo sin estrellas, yo pudiera creer, creer en algo... y en esta creencia yo pidiera ahora, el olvido. Si. El olvido. Es que, en este momento, por alguna sensación que no logro explicar, creo. Yo creo. Creo que soy más cuanto más callo que cuanto más hablo. ¿Se entiende lo que no digo? Sí hablo me siento perdido. Sí callo. (PAUSA) Si: Tengo un secreto.";"no";"cuanto"
"Majfud, Jorge: La reina de América. Alicante: Biblioteca Virtual Miguel de Cervantes, 2004.";"Majfud, Jorge";"La reina de América";2001;"Primera edición";"Ficción";"Escrito";"Libro";"Novela";"Uruguay";"Río de la Plata";"Ficción";;"Me quedé en la vereda de enfrente, haciendo que esperaba un ómnibus, aunque allí no había ninguna parada. Yo esperaba que el Tito se quedara solo para ir a hablarle, pero cuanto más esperaba más tipos se iban amontonando en la entrada. Era evidente: en el medio estaba el Tito, contándoles que me había partido en dos y que ahora yo volvía en busca de más. Podía adivinar la conversación, rodeada de risitas cómplices. Las cosas no salían como yo las había previsto (nunca nada";"si";"cuanto"
"Orellana Suárez, Mauricio: Te recuerdo que moriremos algún día. San Salvador: Dirección de Publicaciones e Impresos, 2001.";"Orellana Suárez, Mauricio";"Te recuerdo que moriremos algún día";2001;"Primera edición";"Ficción";"Escrito";"Libro";"Novela";"El Salvador";"México y Centroamérica";"Ficción";;"Anoche sí que estuve solo, Cuatrita. Me di cuenta de que somos hombres enfermos de soledad de nacimiento, buscando quién nos cure. Y entre más encontramos, entre más gente hemos tenido para paliarnos lo solos que estamos, más solos nos quedamos.";"no";"entre"
"Franco, Jorge: Paraíso Travel. Bogotá: Planeta Colombiana, 2001.";"Franco, Jorge";"Paraíso Travel";2001;"Primera edición";"Ficción";"Escrito";"Libro";"Novela";"Colombia";"Caribe continental";"Ficción";;"de los dedos en el momento de marcar, pero cuando el teléfono repicó comencé a sacudirme. Me recosté donde pude porque de lo contrario me iba a caer. Me sostuve en una sola pierna. La otra convulsionó como una serpiente herida; hasta le dije ofuscado: quédate quieta pierna hijueputa, pero mientras más repicaba más temblaba, hasta que la apoyé con fuerza en el suelo y con el otro pie la pisé y amarré como si fuera un animal que se quisiera escapar. Repicaba y tomé aire porque se me había olvidado respirar. Hasta que por fin escuché la voz de Reina.";"si";"mientras"
"Cuello, Ketty María: El ángel del acordeón. Colombia: I/M Editores, 2001.";"Cuello, Ketty María";"El ángel del acordeón";2001;"Primera edición";"Ficción";"Escrito";"Libro";"Novela";"Colombia";"Caribe continental";"Ficción";;"de licor se lo brindaron a Poncho para hacerle el honor, como era costumbre ante un acordeonista, el segundo al cajero, y el tercero al guacharaquero, después iniciaron la fiesta hasta la luz del otro día. Al principio, Poncho se sintió tímido con el acordeón prestado, pero mientras más tocaba más se familiarizaban, tanto que terminaron fusionados, aparato y él, como si se hubieran tocado el alma. Fueron la sensación. Mamá Cris sin protestar, aceptó dormitar en cama ajena hasta que surgió el cansancio de los músicos; difícil hablarle de cansancio a los verdaderos acordeonistas, porque jamás es suficiente, como";"si";"mientras"
"Espinel, Jaime: «Pégame un tiro y te ladro o viceversa». Cárdeno réquiem: entre toda la eternidad menos un día. Medellín: Editorial Universidad de Antioquia, 2001.";"Espinel, Jaime";"Cárdeno réquiem: entre toda la eternidad menos un día";2001;"Primera edición";"Ficción";"Escrito";"Libro";"Relato";"Colombia";"Caribe continental";"Ficción";;"ahora llueve afuera en la noche, no es por culpa mía, me repito o estoy rediciéndome mientras también pienso que hace ratico no iluminan mi noche ni la de afuera, esa piel que dizque me aparta del perro, los relámpagos. Pienso en Caín ya no como Abel sino como el amo que mientras más conoce a los hombres más ama al que te dije, me digo: Yo soy tu perro, Señor, ¿cuyo perro eres tú? Veo, claro que veo allá abajo la ciudad, esta ""coquita de plata"" que es Medellín a la cual dizque todos adoran pero sólo yo amo y conozco.";"si";"mientras"
"Ferrer Agüero, Luis María: El emperador chino de occidente (El Dr. F.): guión cinematográfico. Buenos Aires: Dunken, 2001.";"Ferrer Agüero, Luis María";"El emperador chino de occidente (El Dr. F.): guión cinematográfico";2001;"Primera edición";"Ficción";"Escrito";"Libro";"Guion";"Paraguay";"Río de la Plata";"Ficción";;"delegado Gil en Paso de Patria fue inútil. Queda para los historiadores una pregunta sugestiva: ¿Qué hubiera pasado si Francia tomaba cartas en el asunto de la Guerra Cisplatina como líder y contra el Brasil? Si la demolición de Asunción era evidente como síntoma fóbico incluso hay otra nota más discreta pero igualmente reveladora: Cuanto más aumentaba su miedo... más aumentaba el presupuesto para el ejército. Esto se hace patente en los últimos años.";"si";"cuanto"
"Hernáez, Luis: Levadura y Mostaza. Asunción: Arandurã, 2001.";"Hernáez, Luis";"Levadura y Mostaza";2001;"Primera edición";"Ficción";"Escrito";"Libro";"Novela";"Paraguay";"Río de la Plata";"Ficción";;"—Cuanto más dura la sequía, más cerca está la lluvia.";"si";"cuanto"
"Wornat, Olga: Menem-Bolocco, S.A.. Buenos Aires: Ediciones B Argentina, 2001.";"Wornat, Olga";"Menem-Bolocco, S.A.";2001;"Primera edición";"No ficción";"Escrito";"Libro";"Ciencias sociales, creencias y pensamiento";"Argentina";"Río de la Plata";;;"como de la entrega del panameño Manuel Antonio Noriega: ""Puede que hayan sido unos miserables, pero la expresión de felicidad exhibida por Bush frente a dichos acontecimientos me parece inaceptable. No puede uno solazarse frente a la desgracia ajena. Eso no es humano. Cuando fui testigo de ese hecho, pensé en aquello de que 'mientras más conozco a los hombres más prefiero a mi perro'. A tal punto que escribí una carta al diario que titulé 'compro perros', la que finalmente no envié..."".";"si";"mientras"
"Sánchez-Andrade, Cristina: Bueyes y rosas dormían. Madrid: Ediciones Siruela, 2001.";"Sánchez-Andrade, Cristina";"Bueyes y rosas dormían";2001;"Primera edición";"Ficción";"Escrito";"Libro";"Novela";"España";;"Ficción";"No siempre hay coincidencia entre párrafo y salto de línea";"entre los árboles, chillan, mugen como terneros y el mugido sale porque no cabe ya más ruido en sus bocas pequeñas, y el sol siempre encanallado se cuela entre los árboles, picotean las espinas de pescado, picotean sin hambre, chocan muchas veces, chocan contra lo que ya han chocado antes, y cuanto más chocan, más chocan y menos plumas tienen, porque sueltan poco a poco una vida sucia que cae ligera desde el cielo hasta la tierra.";"si";"cuanto"
"Terceiro, José B.; Matías, Gustavo: Digitalismo. El nuevo horizonte sociocultural. Madrid: Taurus, 2001.";"Terceiro, José B.; Matías, Gustavo";"Digitalismo. El nuevo horizonte sociocultural";2001;"Primera edición";"No ficción";"Escrito";"Libro";"Política, economía y justicia";"España";;"Divulgación";;"Sin embargo, un primer problema es el de los indicadores de la globalización. La globalización de la economía, una de las tendencias económicas dominantes y aceleradas durante la última década, nos ha traído la paradoja de que, cuanto más avanza, más difícil es seguirle los pasos. Cuanto más apreciamos sus cualidades, más se nos ocultan sus cantidades. Y no nos referimos otra vez a la falta de estadísticas de la nueva economía para construir desde ellas la nueva Economía-ciencia, sino a que las ya existentes pierden identidad con los procesos asociados a la";"si";"cuanto"
"Terceiro, José B.; Matías, Gustavo: Digitalismo. El nuevo horizonte sociocultural. Madrid: Taurus, 2001.";"Terceiro, José B.; Matías, Gustavo";"Digitalismo. El nuevo horizonte sociocultural";2001;"Primera edición";"No ficción";"Escrito";"Libro";"Política, economía y justicia";"España";;"Divulgación";;"Sin embargo, un primer problema es el de los indicadores de la globalización. La globalización de la economía, una de las tendencias económicas dominantes y aceleradas durante la última década, nos ha traído la paradoja de que, cuanto más avanza, más difícil es seguirle los pasos. Cuanto más apreciamos sus cualidades, más se nos ocultan sus cantidades. Y no nos referimos otra vez a la falta de estadísticas de la nueva economía para construir desde ellas la nueva Economía-ciencia, sino a que las ya existentes pierden identidad con los procesos asociados a la mundialización. Así sucede con casi todos los indicadores de la balanza";"si";"cuanto"
"Terceiro, José B.; Matías, Gustavo: Digitalismo. El nuevo horizonte sociocultural. Madrid: Taurus, 2001.";"Terceiro, José B.; Matías, Gustavo";"Digitalismo. El nuevo horizonte sociocultural";2001;"Primera edición";"No ficción";"Escrito";"Libro";"Política, economía y justicia";"España";;"Divulgación";;"- Por último, cuanto más crezca la información, más se reducirá la atención, por lo que también ésta pasará a convertirse en un recurso escaso y alcanzará una mayor valoración. De ahí que la nueva economía será, por encima de todo, economía de la atención y de la emoción, como revelan el creciente uso de captadores de la una o";"si";"cuanto"
"Freixas, Laura: «La noche». Cuentos a los cuarenta. Barcelona: Ediciones Destino, 2001.";"Freixas, Laura";"Cuentos a los cuarenta";2001;"Primera edición";"Ficción";"Escrito";"Libro";"Relato";"España";;"Ficción";;"Fuma jadeando. Cuanto más fuma, más ronca le noto la voz. Pero no callará, no... Impresiona, realmente, cuando uno lo piensa, ese pozo sin fondo que es el alma de las mujeres, su insaciable necesidad de hablar y la maldición que las persigue de que nadie las escuche —por gusto, quiero decir— como";"si";"cuanto"
"Delibes de Castro, Miguel: Vida. La naturaleza en peligro. Madrid: Temas de Hoy, 2001.";"Delibes de Castro, Miguel";"Vida. La naturaleza en peligro";2001;"Primera edición";"No ficción";"Escrito";"Libro";"Ciencias y tecnología";"España";;;;"es hereditaria, los descendientes de aquellos insectos pueden especializarse en vivir sobre esa planta, donde no tienen competidores, y se aislarán de los que no lo hacen. Eso puede ser suficiente para dar lugar a una nueva especie. Insectos y plantas con flores establecen de este modo una carrera de adaptaciones, de modo que cuantos más hay, más se originan. Numerosos fenómenos de este tipo pueden explicar aquella observación del paleontólogo Jablonski de que la tasa de especiación es mayor en las bajas latitudes.";"si";"cuanto"
"Iborra Montells, Antonio: La sanación por los árboles. Manual de las 22 nuevas esencias florales para curar tu cuerpo y equilibrar tus emociones. Barcelona: Océano Ambar, 2001.";"Iborra Montells, Antonio";"La sanación por los árboles. Manual de las 22 nuevas esencias florales para curar tu cuerpo y equilibrar tus emociones";2001;"Primera edición";"No ficción";"Escrito";"Libro";"Salud";"España";;;;"Pero cuidado: un perro ladra y avisa. Nos recuerda que seguimos siendo humanos y que cuanto más subimos, más fuerte puede ser la caída. ¿Podemos sentir nuestra necesidad de aventura? ¿Nos atrevemos a adentrarnos en tierras ignotas donde todo es posible?";"si";"cuanto"
"Beccaria, Lola: La luna en Jorge. Barcelona: Destino, 2001.";"Beccaria, Lola";"La luna en Jorge";2001;"Primera edición";"Ficción";"Escrito";"Libro";"Novela";"España";;"Ficción";;"la arrastra hacia ninguna parte, ningún lazo la ancla a la tierra, ni siquiera los nudos marineros de Jorge. Porque cuando el deseo se convierte en amor, se tiene que echar el ancla, sacrificar el deseo por el lazo afectivo, y ella no es capaz de tal cosa. Por esa misma razón, cuanto más ama, más huye. Por lo que dice Jorge. A veces es tan fuerte la tensión del amor que uno debe soltarse, debe aflojar las amarras porque si no se muere. Ese es el tira y afloja de Sofía.";"si";"cuanto"
"Beccaria, Lola: La luna en Jorge. Barcelona: Destino, 2001.";"Beccaria, Lola";"La luna en Jorge";2001;"Primera edición";"Ficción";"Escrito";"Libro";"Novela";"España";;"Ficción";;"y la diana se vislumbraba diáfana, la estrategia a seguir no figuraba entre las que conformaban el abanico de sus alternativas personales. Porque para buscar a Judith tenía que rastrear un terreno que hacía tiempo había abandonado para siempre. Por eso se dejaba llevar, casi sin rumbo, de la mano de Judith, y cuanto más deseaba salvarla, más parecía arrastrarlo ella a su mundo de fantasía y ensueños, ese mundo perdido, arrumbado por él en la trastienda de la desmemoria desde mucho antes de dejar de ser niño.";"si";"cuanto"
"Boadella, Albert: Memorias de un bufón. Madrid: Espasa Calpe, 2001.";"Boadella, Albert";"Memorias de un bufón";2001;"Primera edición";"No ficción";"Escrito";"Libro";"Artes, cultura y espectáculos";"España";;;;"tan impresionante que a duras penas podía controlar el artefacto. De pronto, dominado por un impulso incontrolable, enfoqué la manguera hacia un grupo de tísicas que tomaban el sol por prescripción médica. Aquellas pobres mujeres, que chillaban desaforadamente, quedaron caladas de arriba abajo. Mi reacción fue la de un animal salvaje: cuanto más chillaban, más ferozmente las regaba.El barullo fue tan monumental que una extraterrestre de alas en la cabeza, llamada sor María del Pilar, me responsabilizó de todas las previsibles muertes. Cuando unos días después, como de costumbre, apareció el coche negro de caballos con plumas en la cabeza, comprendí automáticamente que venía a recoger";"si";"cuanto"
"Boadella, Albert: Memorias de un bufón. Madrid: Espasa Calpe, 2001.";"Boadella, Albert";"Memorias de un bufón";2001;"Primera edición";"No ficción";"Escrito";"Libro";"Artes, cultura y espectáculos";"España";;;;"el mañana era responsabilidad exclusiva de la providencia.La prueba salió catastrófica; yo no era un buen actor, pero tampoco tan inútil como parecí. Gómez estaba desesperado, pues quería tener un buen compañero durante el largo tiempo de grabación, y hacía todo lo posible por convencer a los directivos de mi valía. Cuanto más insistía, más desconfiaban los alemanes, pues se debían de imaginar que aquel español patoso era simplemente un compañero de parrandas que Gómez les quería endosar como actor. Naturalmente no me aceptaron, y volví con una reconfortante sensación de liberación, aunque muy sorprendido de la extraña pirueta de mi subconsciente durante la prueba.Sorprendentemente,";"si";"cuanto"
"Aburto, Juan: «A renovar su PC». La Prensa de Nicaragua. Informática. Managua: laprensa.com.ni, 2001-04-10.";"Aburto, Juan";"La Prensa de Nicaragua. Informática";2001;"Primera edición";"No ficción";"Escrito";"Prensa";"Ciencias y tecnología";"Nicaragua";"México y Centroamérica";;;"su vez, cada procesador tiene características y recursos que lo hacen único en su género; frecuencia, cantidad de memoria, ausencia, presencia y tamaño de la memoria caché, coprocesador, etc. Otra característica de las tarjetas maestras es la cantidad de ranuras para los bancos de memoria y para las tarjetas de expansión: mientras más tenga un modelo, más recursos —memoria, extensiones— podrá incorporarle eventualmente.";"si";"mientras"
"Sabanero, Sandra: Boda Mexicana. Barcelona: Ediciones B, 2002.";"Sabanero, Sandra";"Boda Mexicana";2002;"Primera edición";"Ficción";"Escrito";"Libro";"Novela";"México";"México y Centroamérica";"Ficción";;"los pocos, el doctor Alejandro Dávila, un capitalino de aire distraído y bondadoso que había llegado a refundirse a Los Remedios por razones inexplicables. El sentía por ella compasión y, desde mucho tiempo antes, un amor platónico, No concebía que Francisco maltratara a una mujer tan frágil y de modales tan delicados. Entre más percibía sus sufrimientos, más se lamentaba de no haberla conocido antes. El médico supo de su existencia el día que la bisabuela sufrió el ataque de apoplejía. La acompañó durante sus horas de angustia y fue testigo de su devoción hacia la enferma. Lo impresionó el candor de su mirada y la suavidad de su";"si";"entre"
"Ruiz, Fabiola: Telares. México D. F.: Ediciones Era, CONACULTA-INBA, 2002.";"Ruiz, Fabiola";"Telares";2002;"Primera edición";"Ficción";"Escrito";"Libro";"Novela";"México";"México y Centroamérica";"Ficción";;"tragos en la cantina del Quetuta, donde antes se vendían los mentados amarguitos. Van vestidos a la usanza de otra época, los hombres usan pantalones cortos y las mujeres escote hasta las nalgas. Los catrines del pueblo la nombran ""Bar El Talador"". Será que entre más camino más ando y entre más ando más diviso todas las cosas que nos trajo el tal Tereso. A veces como que algo se me apaga por dentro. Entonces nada más camino.";"si";"entre"
"Arroyo, Justo: Vida que olvida. Costa Rica: Alfaguara, 2002.";"Arroyo, Justo";"Vida que olvida";2002;"Primera edición";"Ficción";"Escrito";"Libro";"Novela";"Panamá";"México y Centroamérica";"Ficción";;"Lo peor era su incapacidad para emborracharse. Si por lo menos perdiera el conocimiento, si por lo menos pudiera embrutecerse su vida tendría sentido porque entonces podría desconectarse y afrontar el día sabiendo que al final lo esperaba la inconsciencia. Pero mientras más bebía más lúcido se tornaba y en la soledad de su oficina podía repasar minuto a minuto sus actividades desde que bajó del barco con Antonia hasta el nacimiento de sus hijas; su lucha por dejar atrás la pobreza de modo de brindarle seguridad a su familia. Pero de esa familia sólo quedaba ahora una anciana";"si";"mientras"
"Arroyo, Justo: Vida que olvida. Costa Rica: Alfaguara, 2002.";"Arroyo, Justo";"Vida que olvida";2002;"Primera edición";"Ficción";"Escrito";"Libro";"Novela";"Panamá";"México y Centroamérica";"Ficción";;"no paraba de hablar cuando estaba con ella, ahora se encontraba mudo y de seguro le transmitía una imagen de retrasado mental, a ella, su esposa, la mujer a quien debía impresionar. Pero la idea de que hubieran transcurrido dos días y que todavía no hubieran hecho el amor le resultaba intolerable, y mientras más pensaba en ello, más le atemorizaba un nuevo descalabro.";"si";"mientras"
"Pantoja, Oscar: El hijo. Bogotá: Fundación Universidad Central, 2002.";"Pantoja, Oscar";"El hijo";2002;"Primera edición";"Ficción";"Escrito";"Libro";"Novela";"Colombia";"Caribe continental";"Ficción";;"camino. Veo a lo lejos, muy lejos, un campamento. Imagino que en el campamento hay música y agua y mujeres, y no sé por qué imagino que todas las mujeres de la tienda tienen la cara de Sandra y son Sandra. Corro desesperado por la arena para llegar lo antes posible, pero cuanto más corro, más larga es la distancia, entonces todo se vuelve confuso y me veo en un cuarto completamente oscuro. Estoy en un rincón y el miedo me quema la carne. Sé que voy a morir y sé quién me va a matar. Se abre una puerta y aparece mi hijo con un cuchillo en la";"si";"cuanto"
"Ungar, Antonio: «Kamandil Viarko». Mery Giraldo, Luz [comp.]: Cuentos caníbales. Antología de nuevos narradores colombianos. Bogotá: Alfaguara, 2006.";"Mery Giraldo, Luz [comp.]";"Cuentos caníbales. Antología de nuevos narradores colombianos";2002;"Primera edición";"Ficción";"Escrito";"Libro";"Relato";"Colombia";"Caribe continental";"Ficción";;"gendarme que me seguía mirando muy estreñido y muy nervioso desde el andén, que se ponía pálido mientras escupía sólo una o dos frases en su lengua de cólicos y náuseas. No soy un animal, joven, le dije: no soy un animal, no soy un animal, no soy un animal, y entre más repetía la frase más sentía que la sangre se me subía a la cabeza, y si mi primo Bogol no mira con sus ojos a los ojos del mozo este y sin abrir su boca le dice ""lárgate ahora mismo, hijo, largo"", creo que hubiera muerto un sucio policía entre estas manos";"si";"entre"
"Alburquerque, Andrés: «El reo». Diez cuentos cubanos, más o menos. Madrid: Editorial Betania, 2002.";"Alburquerque, Andrés";"Diez cuentos cubanos, más o menos";2002;"Primera edición";"Ficción";"Escrito";"Libro";"Relato";"Cuba";"Antillas";"Ficción";;"liberado de toda la ropa, trataba de estimularla con sus manos, con sus dedos de soldado enmohecido, con su lengua de adolescente hambriento, pero las mucosas secas le hacían comprender que no era bienvenido, podía aprovechar la situación, pero no disfrutarla, era el ritual de casi todas las noches y mientras más sufría su indiferencia más sentía la necesidad de poseerla, de hacerla suya a toda costa, de romper su resistencia, como había roto su libertad, de tomar esta ""plaza"" que no se rendía a pesar de su inferioridad numérica y a la que entraba vencedor pero sin vítores ni aclamaciones.";"si";"mientras"
"Martínez, Tomás Eloy: El vuelo de la reina. Madrid: Alfaguara, 2002.";"Martínez, Tomás Eloy";"El vuelo de la reina";2002;"Primera edición";"Ficción";"Escrito";"Libro";"Novela";"Argentina";"Río de la Plata";"Ficción";;"noches, para la mujer es un asunto de vida o muerte. ¿Soy otra desde que soy con vos? Qué frase tan impúdica. A él le ha bastado silbar, lanzar al aire el nombre de un hotel, para que ella se eche a correr en su busca como una perra hambrienta. Cuanto más lee los mensajes, más se indigna, no contra la mujer sino contra sí mismo. ¿Así le paga ella las noches que ha pasado en vela recorriendo su cuerpo a través de las lentes del telescopio Bushnell, custodiándola de lejos, acechando el menor trastorno de su respiración? Se lo veía venir: tarde o";"si";"cuanto"
"Mendoza, Mario: Satanás. Barcelona: Seix Barral, 2002.";"Mendoza, Mario";"Satanás";2002;"Primera edición";"Ficción";"Escrito";"Libro";"Novela";"Colombia";"Caribe continental";"Ficción";;"acabar mi vida aquí, en la absoluta quietud de mi cabaña. Ah sí, soy un gran delincuente. ¿Y qué? Más adelante, Andrés vuelve a detenerse: ¿Qué me ha dejado esto? Una completa derrota, enemigos y nada más. La mala suerte me persigue incesantemente desde que vivo; cuanto más avanzo tanto más me hundo. El exilio y la soledad como única posibilidad de mantener intacta la dignidad personal. Un Mesías sin rebaño, sin discípulos ni muchedumbres que lo admiren y lo aplaudan. Tarde o temprano el artista renuncia y se aleja para reencontrar aquella parte de sí que la sociedad le impide apreciar y reconocer";"si";"cuanto"
"Bucay, Jorge: El camino de la autodependencia. Barcelona: Grijalbo, 2002.";"Bucay, Jorge";"El camino de la autodependencia";2002;"Primera edición";"No ficción";"Escrito";"Libro";"Ciencias sociales, creencias y pensamiento";"Argentina";"Río de la Plata";;;"Aprendimos de su mano que esta contradicción quizás esté allí para indicar que ambas cosas suceden al mismo tiempo, porque uno conoce y ama al mismo tiempo, y cuanto más conoce más ama y cuanto más ama más puede conocer. Dicho de otra manera, no puedo amar algo que no conozco y no puedo conocer algo que no amo.";"si";"cuanto"
"Bucay, Jorge: El camino de la autodependencia. Barcelona: Grijalbo, 2002.";"Bucay, Jorge";"El camino de la autodependencia";2002;"Primera edición";"No ficción";"Escrito";"Libro";"Ciencias sociales, creencias y pensamiento";"Argentina";"Río de la Plata";;;"Aprendimos de su mano que esta contradicción quizás esté allí para indicar que ambas cosas suceden al mismo tiempo, porque uno conoce y ama al mismo tiempo, y cuanto más conoce más ama y cuanto más ama más puede conocer. Dicho de otra manera, no puedo amar algo que no conozco y no puedo conocer algo que no amo.";"si";"cuanto"
"Casavella, Francisco: Los juegos feroces. Barcelona: Mondadori, 2002.";"Casavella, Francisco";"Los juegos feroces";2002;"Primera edición";"Ficción";"Escrito";"Libro";"Novela";"España";;"Ficción";;"cruza una calle, que no se ha ido porque le han visto por aquí y le han visto por allá. Pero luego preguntan y de fijo nadie lo ha visto. A mí me han hecho el encargo de que os buscara. Aquí estáis. Así que ahora nos lo tomamos con suavidad y luego subimos. Cuanto más tardéis en subir, más vais a tardar en pillar. Y yo descanso. Que anoche fue sábado y anduvimos hasta las tantas vacilando por ahí.";"si";"cuanto"
"Casavella, Francisco: Los juegos feroces. Barcelona: Mondadori, 2002.";"Casavella, Francisco";"Los juegos feroces";2002;"Primera edición";"Ficción";"Escrito";"Libro";"Novela";"España";;"Ficción";;"Celso, dile que ha dicho la Francesa que tú y tu madre sois agua del río. ¿Me has entendido bien, pequeño? Agua del río. -Quise irme, pero me cogió de un brazo-: Pero lo tienes que decir cuando ya no te quede más remedio. Cuanto más oigas y veas, más sabrán ellos que sabes, más te respetarán y más provecho sacarás de la situación. Tienes que volver buena una situación mala, ¿no es verdad?";"si";"cuanto"
