"BIBLIOGRAFIA";"AUTOR";"TITULO";"FECHA";"CRITERIO";"BLOQUE";"MEDIO";"SOPORTE";"TEMA";"PAIS";"ZONA";"TIPOLOGIA";"NOTAS";"CONCORDANCIA";"Valida";"cuantificador"
"Rodríguez, E. J.: «Bobby Fischer (IV): ""¿Qué le pasa a Fischer?""». Jot Down Cultural Magazine. Sevilla: jotdown.es, 2013-04.";"Rodríguez, E. J.";"Jot Down Cultural Magazine";2013;"Primera edición";"No ficción";"Escrito";"Prensa";"Actualidad, ocio y vida cotidiana";"España";;"Reportaje";"Periodicidad: mensual";"En resumen... ¡un despropósito! Cuanto más mejoraba su juego y más preparado parecía para poder optar a la corona mundial, más obstáculos se ponía en su propio camino. El desaliento cundió en la federación estadounidense. La decepción se apoderó de los aficionados y periodistas de su país, y de todo Occidente, ante el evidente desinterés del único individuo del";"no";"cuanto"
"Tabernero, Josep: «El papel del oncólogo. La oncología de hoy y de ayer». El Mundo. Madrid: elmundo.es, 2013-02-15.";"Tabernero, Josep";"El Mundo";2013;"Primera edición";"No ficción";"Escrito";"Prensa";"Salud";"España";;"Opinión";;"del cáncer por su nombre porque, por primera vez, conocemos al enemigo y éste es el primer paso para la curación. Pero aún falta mucho camino por recorrer, un desafío intelectual cada día más complejo que crece y crece con cada nuevo tumor descubierto o cada fármaco testado. A veces creemos que cuanto más aprendemos sobre el cáncer más cerca estamos de conocerlo en su totalidad. Sin embargo, estamos abriendo más vías de conocimiento y más campos de investigación que darán que pensar a los oncólogos durante muchos años.";"si";"cuanto"
"Ampuero, Fernando: «Loreto». Cuarteto de Lima. Lima: Tusquets, 2019.";"Ampuero, Fernando";"Cuarteto de Lima";2014;"Primera edición";"Ficción";"Escrito";"Libro";"Novela";"Perú";"Andina";"Ficción";;"Luego, de súbito, Chito se demudó. Las sospechas acerca de los últimos acontecimientos comenzaron a abrumarlo. Le venían dudas reiterativas. ¿No tendrá la gomeada a Kike alguna conexión con el chiquillo?, se preguntaba. Era como haber caído en arenas movedizas, pues cuanto más pensaba en ello, más se hundía. Hasta que una tarde en que Chito y Silverio salieron juntos a cobrar cupos a un edificio en construcción, el primero encendió un cigarrillo y permaneció un rato con expresión pensativa. Para esperar a los ingenieros, sin llamar la atención más de la cuenta, Chito había estacionado su";"si";"cuanto"
"Simeone, Diego Pablo: Simeone. Partido a partido. Barcelona: Plataforma Editorial, 2014.";"Simeone, Diego Pablo";"Simeone. Partido a partido";2014;"Primera edición";"No ficción";"Escrito";"Libro";"Actualidad, ocio y vida cotidiana";"Argentina";"Río de la Plata";"Divulgación";;"«Cuanto más trabajes, cuanta más preparación y argumentos poseas, la suerte aparecerá de manera más frecuente.»";"no";"cuanto"
"Simeone, Diego Pablo: Simeone. Partido a partido. Barcelona: Plataforma Editorial, 2014.";"Simeone, Diego Pablo";"Simeone. Partido a partido";2014;"Primera edición";"No ficción";"Escrito";"Libro";"Actualidad, ocio y vida cotidiana";"Argentina";"Río de la Plata";"Divulgación";;"Cuanto más trabajes, cuanta más preparación y argumentos poseas, la suerte aparecerá de manera más frecuente.";"no";"cuanto"
"Bayly, Jaime: La lluvia del tiempo. Buenos Aires: Alfaguara, 2014.";"Bayly, Jaime";"La lluvia del tiempo";2014;"Primera edición";"Ficción";"Escrito";"Libro";"Novela";"Perú";"Andina";"Ficción";;"el rumor de que era drogadicto y amante de las prostitutas de lujo —Balaguer nunca había probado drogas ilegales ni había estado con una prostituta, le daba pavor—, que era un mal ejemplo para la juventud por haber dejado sus estudios de Derecho, que no tenía amigos, solo enemigos. Era cierto, cuanto más salía en televisión y más dinero ganaba y más famoso se hacía, menos amigos tenía. Pero él pensaba que perdía a sus amigos no porque ellos ya no tuviesen ganas de verlo, sino porque de pronto les veía defectos, le parecía que no eran todo lo leales y generosos que debían ser, los encontraba";"no";"cuanto"
"Carvajal, Jonny Fernando: «El cuarto rojo». Revista Colombiana de Artes Escénicas. Caldas: vip.ucaldas.edu.co/artesescenicas, 2014.";"Carvajal, Jonny Fernando";"Revista Colombiana de Artes Escénicas";2014;"Primera edición";"Ficción";"Escrito";"Libro";"Teatro";"Colombia";"Caribe continental";"Ficción";;"MUJER:Les encanta. Entre más grite, más hombres se sienten.";"si";"entre"
"Villoro, Juan: ¿Hay vida en la Tierra?. Barcelona: Anagrama, 2014.";"Villoro, Juan";"¿Hay vida en la Tierra?";2014;"Primera edición";"Ficción";"Escrito";"Libro";"Relato";"México";"México y Centroamérica";"Ficción";;"Mientras más hablaba, más limitados nos sentíamos. Sin embargo, poco a poco nos reconciliamos con nuestros malentendidos. La belleza es siempre disruptiva. Nadie había podido precisar el aspecto de la novelista y quienes oímos esas descripciones se las atribuimos más tarde a distintas personas; algunas desmerecieron al no poseer su aura, otras revelaron un misterio";"si";"mientras"
"Núñez, Matías: Yugoslavia. Montevideo: Ediciones de la Banda Oriental, 2014.";"Núñez, Matías";"Yugoslavia";2014;"Primera edición";"Ficción";"Escrito";"Libro";"Novela";"Uruguay";"Río de la Plata";"Ficción";;"Yo me quedé callado para no hacérsela fácil y que ella, sólita, se fuera dando cuenta de la cantidad de pelotudeces que me estaba encajando. Mientras más hablaba, más nerviosa se ponía, hasta que no aguantó más y me dijo que le diera un rato para ver qué podía hacer, que en diez minutos me llamaba al número de teléfono que le aparecía en el celular. ""No, no estoy en la casa de nadie, es una cabina telefónica""";"si";"mientras"
"Fernández Koprich, Daniel: Equipos directivos para los tiempos que corren. Providencia, Santiago de Chile: Aguilar Chilena de Ediciones, 2014.";"Fernández Koprich, Daniel";"Equipos directivos para los tiempos que corren";2014;"Primera edición";"No ficción";"Escrito";"Libro";"Política, economía y justicia";"Chile";"Chilena";"Académico";;"lo contrario, comenzará a decaer: ""La práctica de una disciplina supone un compromiso constante con el aprendizaje. 'Nunca se llega': uno se pasa la vida dominando disciplinas. Nunca se puede decir: 'Somos una organización inteligente', así como nadie puede decir: 'Soy una persona culta'. Cuanto más aprendemos, más comprendemos nuestra ignorancia. Una empresa no puede ser 'excelente', en el sentido de haber alcanzado una excelencia permanente; siempre está practicando las disciplinas del aprendizaje, al borde de ser mejor o peor"".";"si";"cuanto"
"Nieto Aguilar, Antonio: Propaganda. Madrid: Ediciones Irreverentes, 2014.";"Nieto Aguilar, Antonio";"Propaganda";2014;"Primera edición";"Ficción";"Escrito";"Libro";"Teatro";"España";;"Ficción";;"LAURA: Lo inevitable... Cuanto más hablas, más escondes, Angelo.";"si";"cuanto"
"Tabernero, Santiago; Noriega, Eduardo: Presentimientos. s. l.: s. n., 2014.";"Tabernero, Santiago; Noriega, Eduardo";"Presentimientos";2014;"Fecha de estreno";"Ficción";"Escrito";"Libro";"Guion";"España";;"Ficción";"Basado en la novela homónima de Clara Sánchez";"Marcus acaricia su pelo, tira de él. Cuanto más tira más le gusta a Julia.";"si";"cuanto"
"Sánchez Salinero, Fernando: ¿Qué leches es el Estado de bienestar? Manual anti-demagogia para tiempos revueltos. Barcelona: Alienta, 2014.";"Sánchez Salinero, Fernando";"¿Qué leches es el Estado de bienestar? Manual anti-demagogia para tiempos revueltos";2014;"Primera edición";"No ficción";"Escrito";"Libro";"Política, economía y justicia";"España";;"Divulgación";;"Cuanto más avancemos, más difícil haremos posible la supervivencia del país, y el poder ayudar a quien de verdad lo necesita.";"si";"cuanto"
"Sánchez Salinero, Fernando: ¿Qué leches es el Estado de bienestar? Manual anti-demagogia para tiempos revueltos. Barcelona: Alienta, 2014.";"Sánchez Salinero, Fernando";"¿Qué leches es el Estado de bienestar? Manual anti-demagogia para tiempos revueltos";2014;"Primera edición";"No ficción";"Escrito";"Libro";"Política, economía y justicia";"España";;"Divulgación";;"Sería como ir echando piedras en la bodega de un barco. Cuantas más echemos, más difícil será la navegación, más riesgo de hundirnos tendremos y, en caso del más mínimo problema, nos hundiremos mucho más deprisa. Esto, que dicho así, puede parecer muy simple de comprender, sin embargo, es muy difícil de llevar a la práctica, porque...";"si";"cuanto"
"Herbada, Lidia: 39 cafés y un desayuno. Barcelona: Espasa, 2014.";"Herbada, Lidia";"39 cafés y un desayuno";2014;"Primera edición";"Ficción";"Escrito";"Libro";"Novela";"España";;"Ficción";;"Todas contamos con miles de aventuras de hombres cobardes, de primates» que no saben lo que quieren, y ahí estás tú, dándoles absolutamente todo y pensando que cuanto más regalas más les acercas a ti, pero suele ocurrir lo contrario: el efecto bumerán. «Sé un poco perra y te querrán más», pero eso será la historia de otro libro.";"si";"cuanto"
"Mitre, Cristina: Mujeres que corren. Todo lo que necesitas saber sobre el running. Madrid: Temas de Hoy, 2014.";"Mitre, Cristina";"Mujeres que corren. Todo lo que necesitas saber sobre el running";2014;"Primera edición";"No ficción";"Escrito";"Libro";"Actualidad, ocio y vida cotidiana";"España";;"Divulgación";;"— Desarrollo del metabolismo aeróbico que es la forma que tiene nuestro organismo de obtener energía de forma aeróbica, es decir, con aporte de oxígeno. «Cuanto más desarrollemos este sistema y más oxígeno llegue a nuestro músculo, más energía vamos a ser capaces de producir» señala González.";"no";"cuanto"
"Casanovas, Anna: Donde empieza todo. Madrid: Harlequin Ibérica, 2014.";"Casanovas, Anna";"Donde empieza todo";2014;"Primera edición";"Ficción";"Escrito";"Libro";"Novela";"España";;"Ficción";;"Era cómico cómo el destino le había demostrado que el amor a primera vista existía. Aunque si solo hubiese sido eso, un absurdo amor a primera vista, tal vez lograría superarlo y olvidarla, pero cuanto más conocía a Victoria más perdido estaba, más cerca se sentía de ella y más la necesitaba.";"si";"cuanto"
"Casanovas, Anna: Donde empieza todo. Madrid: Harlequin Ibérica, 2014.";"Casanovas, Anna";"Donde empieza todo";2014;"Primera edición";"Ficción";"Escrito";"Libro";"Novela";"España";;"Ficción";;"Pasó el resto del día en casa, repasó las pruebas que habían encontrado y releyó la información que habían reunido sobre Holmes y Wortex, porque quería estar lo más preparado posible por si conseguía oír o ver algo. Cuanto más tuviera asimilado más fácil le resultaría entender lo que tuviese delante. Una hora y media antes del baile se duchó y se vistió con un traje negro que solo utilizaba en eventos de sus padres o de su hermano. La última vez que se lo había puesto había sido para asistir a una entrega de premios deportivos";"si";"cuanto"
"García Soubriet, Sonia: «El viaje». La desesperación del león y otras historias de la India. Palencia: Menoscuarto, 2014.";"García Soubriet, Sonia";"La desesperación del león y otras historias de la India";2014;"Primera edición";"Ficción";"Escrito";"Libro";"Relato";"España";;"Ficción";;"refugió enseguida en la habitación con su parpadeante luz macilenta. «Qué hacemos aquí», murmuró. Por fin él entró sonriente: «¿Qué te pasa?». Ella le contestó que se quería marchar y a su deseo siguió una avalancha de razones que le fue diciendo ofuscada con lágrimas en los ojos. Cuanto más había visto más incomprensible le resultaba la idea de quedarse allí dando vueltas por esos caminos, bordeando ese mar furioso, comiendo todos los días el arroz insípido de los restaurantes y presenciando el transcurso de vidas llenas de miseria y sin escapatoria posible. Él la escuchó en silencio y cuando acabó le dijo que si se";"si";"cuanto"
"RTVE: La aventura del saber. ";"RTVE";"La aventura del saber";2014;"Fecha de emisión";" ";"Oral";" ";;"No identificado";"No identificado";"Otros";;"de solo sé que no sé nada y cuánto más sé / pues / mmm más perdido";"si";"cuanto"
"Romano, Juan Martín: «Cómo entrenar la capacidad de elegir». Clarín. Buenos Aires: clarin.com, 2014-03-25.";"Romano, Juan Martín";"Clarín";2014;"Primera edición";"No ficción";"Escrito";"Prensa";"Salud";"Argentina";"Río de la Plata";"Divulgación";;"y la aparición de la respuesta emocional, se vaya haciendo cada vez más largo. Es decir, se fomenta la evaluación reflexiva (y, por tanto, más lenta), dándonos tiempo para recapacitar y pensar cuál es la respuesta apropiada para la situación en que nos encontramos. ¿Como helado o como yogurt? Cuanto más practiquemos la meditación, más fácil nos será evaluar los estímulos de manera reflexiva, en lugar de hacerlo de forma automática.";"si";"cuanto"
"«Cómo crear música con tus ojos». CNN Español. Nueva York: cnnespanol.cnn.com, 2014-12-23.";;"CNN Español";2014;"Primera edición";"No ficción";"Escrito";"Prensa";"Ciencias y tecnología";"Estados Unidos";"Estados Unidos";"Noticia";;"No necesitas talento musical para usar el sistema, pero mientras más entiendes de música, más fácil te será —si entiendes, por ejemplo, que las negras son más rápidas que las semicorcheas tendrás una idea de lo que estás seleccionando— después de 10 segundos escuchas el fragmento de música que seleccionaste interpretado por un cuarteto de cuerdas, así que aprendes rápido.";"si";"mientras"
"«Cómo interesar a los niños en la lectura en estas vacaciones». CNN Español. Nueva York: cnnespanol.cnn.com, 2014-05-05.";;"CNN Español";2014;"Primera edición";"No ficción";"Escrito";"Prensa";"Ciencias sociales, creencias y pensamiento";"Estados Unidos";"Estados Unidos";"Varios";;"Mientras más leas, más niños anhelarán leer a menudo también. Llena tu casa de libros, ya sea en tabletas o mesas, y asegúrate de que tus hijos te vean leer, y disfrutarlo. Quindlen dijo que sus tres hijos crecieron viendo a su madre detrás de un libro tan a menudo que se preguntaron:";"si";"mientras"
"Taborda Herrera, Ernesto: «""Colombia País de Regiones tendrá cara en el tarjetón"": Verano». El Universal. Cartagena de Indias: El Universal.com.co, 2014-01-11.";"Taborda Herrera, Ernesto";"El Universal";2014;"Primera edición";"No ficción";"Escrito";"Prensa";"Política, economía y justicia";"Colombia";"Caribe continental";"Noticia";;"Sobre cómo enfrentará su candidatura, Verano dijo que ""vamos a soportar todas las dificultades, cómo enfrentarnos a un presidente candidato y la pelea que tenemos que dar para promover una alternativa de gobierno diferente, porque el centralismo tiene todo el poder, lo manipula, lo maneja, lo domina, y entre más haga eso, más ciudadanos en contra tendrá"", dijo.";"si";"entre"
"«Descansar sin engordar». Semana. Bogotá: Semana.com, 2014-12-20.";;"Semana";2014;"Primera edición";"No ficción";"Escrito";"Prensa";"Salud";"Colombia";"Caribe continental";"Noticia";;"Los expertos dicen que si quiere salir victorioso en esta época hay que tener fuerza de voluntad y para ello lo mejor es entender que hay que ejercitar esta habilidad como si fuera un músculo. Mientras más diga no, más fácil será resistir las tentaciones de comer exageradamente. También recomiendan dejar el estrés a un lado porque la ansiedad promueve las ganas de comer. En las reuniones se recomienda distraer la atención con actividades diferentes a comer, como bailar o hablar con amigos. Y lo mejor es recordar que cada persona controla";"si";"mientras"
"Jawtuschenko, Ignacio: «""La física no es una ciencia exacta""». Página/12. Buenos Aires: pagina12.com.ar/diario/ciencia/19-261615-2014-12-10.html, 2014-12-10.";"Jawtuschenko, Ignacio";"Página/12";2014;"Primera edición";"No ficción";"Escrito";"Prensa";"Ciencias sociales, creencias y pensamiento";"Argentina";"Río de la Plata";"Entrevista";;"—A veces uno usa la siguiente idea que ayuda para explicarlo: el bosón de Higgs es como una especie de fluido viscoso que impregna el espacio, entonces cuando las partículas se mueven en ese espacio —que no es el vacío— adquieren su masa por interactuar con este fluido, cuanto más interactúan más masa tienen y cuanto menos interactúan menos masa tienen.";"si";"cuanto"
"Moledo, Leonardo: «Impulso a la ciencia y tecnología andinas». Página/12. Buenos Aires: pagina12.com.ar/diario/ciencia/19-249353-2014-06-25.html, 2014-06-25.";"Moledo, Leonardo";"Página/12";2014;"Primera edición";"No ficción";"Escrito";"Prensa";"Ciencias y tecnología";"Argentina";"Río de la Plata";"Entrevista";;"reglamentó, entonces no está en vigencia. La producción en agricultura es muy caótica. Los productores usan plaguicidas que están prohibidos. Ellos tienen el prejuicio de que cuando llueve hay que poner más plaguicida porque la lluvia lava. Nosotros hicimos un trabajo de investigación con ellos y les demostramos que uno de los plaguicidas, cuanto más llueve, más se absorbe, por ejemplo. Los manuales, los marbetes de los plaguicidas explicitan tiempos de carencia, que es el tiempo que tiene que transcurrir entre la aplicación del plaguicida y la recolección de los frutos o de las hortalizas. Esos tiempos de carencia los deben hacer en un escritorio acá en Buenos Aires";"si";"cuanto"
"Burgos, Javier S.: «Raquel Lanseros: «La poesía es el territorio absoluto de la libertad»». Jot Down Cultural Magazine. Sevilla: jotdown.es, 2014-04.";"Burgos, Javier S.";"Jot Down Cultural Magazine";2014;"Primera edición";"No ficción";"Escrito";"Prensa";"Ciencias sociales, creencias y pensamiento";"España";;"Entrevista";"Periodicidad: mensual";"En Latinoamérica hay gente muy interesante. De quinientos millones de hablantes nacidos de lengua española nosotros somos apenas un diez por ciento. Imagínate la riqueza cultural. Cuanto más voy más me impresiona la magnitud y el calado de la cultura de todos los países que componen Hispanoamérica. Creo que además es un legado —meto la cuña—, y que España está un poco ciega de no volcarse hacia él. Histórica y culturalmente es nuestro cauce. Mucho más que otras tierras que igual";"si";"cuanto"
"Foguet, Carles A.: «Albert Rivera: «Tomé la decisión de que si tenía un cargo, era para ejercerlo»». Jot Down Cultural Magazine. Sevilla: jotdown.es, 2014-06.";"Foguet, Carles A.";"Jot Down Cultural Magazine";2014;"Primera edición";"No ficción";"Escrito";"Prensa";"Política, economía y justicia";"España";;"Entrevista";"Periodicidad: mensual";"el 90% de las cosas? Quizás reivindicar aquello que nos une nos daría más fuerza para tener nuestra autonomía, nuestras competencias y nuestros recursos. Pero creo que se ha tensado tanto la cuerda que ya no hay unanimidad o amplias mayorías en temas muy importantes, sino que el debate se ha polarizado. Y cuanto más tenses, más gente se cae del caballo. Ahora se vende una unanimidad cuando la realidad es que Convergencia, Esquerra e Iniciativa son quienes están en un espacio, y después PSC, PP y nosotros, con matices, estamos en otro. Y esto polariza las votaciones en el Parlament.";"si";"cuanto"
"Gutiérrez Valero, M. Ángeles: «Cómo compartir más veces sin hacer spam en Social Media». Apasionada de las Redes Sociales. https://apasionadadelasredessociales.wordpress.com: apasionadadelasredessociales.wordpress.com, 2015-06-09.";"Gutiérrez Valero, M. Ángeles";"Apasionada de las Redes Sociales";2015;"Fecha de escritura";"No ficción";"Escrito";" ";"Ciencias y tecnología";"España";;"Blog";;"Una vez que hemos creado un buen contenido debemos difundirlo en nuestras redes sociales, y por supuesto en nuestros grupos de Linkedin, de Google Plus etc. Cuanto más difundamos nuestro post, más posibilidades tendremos de llegar a más usuarios. Sin embargo, si copiamos nuestro post tal cual en todas las redes sociales, estaremos haciendo spam.";"si";"cuanto"
"Zúñiga, Diego: Racimo. Barcelona: Penguin. Random House, 2015.";"Zúñiga, Diego";"Racimo";2015;"Primera edición";"Ficción";"Escrito";"Libro";"Novela";"Chile";"Chilena";"Ficción";;". Todavía tienen arena en sus cuerpos. Leonor lleva un vestido delgado, Ana también. Torres Leiva está con short. Avanzan. La arena en los zapatos, la neblina, las personas que caminan rápido, algunas corren, los niños lloran. Leonor no ha dicho una palabra. Abraza con fuerza a Torres Leiva. Mientras más suben, más gente se suma. Ana va atrás de él. Ahora suenan las sirenas de distintos autos, la neblina baja y se vuelve cada vez más densa. No se ve el cerro, pero caminan. No se ve más allá de un par de metros de ellos. Las luces de la calle parecen";"si";"mientras"
"Becerra, Juan José: El espectáculo del tiempo. Buenos Aires: Seix Barral, 2015.";"Becerra, Juan José";"El espectáculo del tiempo";2015;"Primera edición";"Ficción";"Escrito";"Libro";"Novela";"Argentina";"Río de la Plata";"Ficción";;"La cordialidad de Franklin la aislaba en un pabellón de soledad ¿Qué tipo de crueldad lo impulsaba a no abandonarla del todo? Cuanto más hablaba su mujer, más silencio se acumulaba como un tesoro entre él y su secretaria. El silencio los enlazaba en el interior de un universo perfecto. Ese idioma primitivo los hermanaba, y les permitía amarse sin manifestaciones, anulando la proximidad de esa enemiga entregada todo el tiempo a combatirlos con el derecho adquirido";"si";"cuanto"
"Barboza, Sascha: Las recetas de @Sascha Fitness. Barcelona: Planeta, 2015.";"Barboza, Sascha";"Las recetas de @Sascha Fitness";2015;"Primera edición";"No ficción";"Escrito";"Libro";"Actualidad, ocio y vida cotidiana";"Venezuela";"Caribe continental";"Divulgación";;"Mientras más sudo más grasa pierdo";"si";"mientras"
"Benassi, Alfredo: Ciudad botánica: oasis del desierto urbano. La Plata: el autor, 2015.";"Benassi, Alfredo";"Ciudad botánica: oasis del desierto urbano";2015;"Primera edición";"No ficción";"Escrito";"Libro";"Artes, cultura y espectáculos";"Argentina";"Río de la Plata";"Académico";;"Cuanto más conocemos sobre nuestro paisaje más preguntas podremos realizarnos sobre su calidad y sobre sus posibilidades de cambio. Es decir que ignoramos más cuanto más conocemos sobre un tema o una cosa. Considerar nuestro propio entorno como un acertijo es convocar la posibilidad de nuevos horizontes vivenciales creativos.";"si";"cuanto"
"Sánchez Arévalo, Daniel: La isla de Alice. Barcelona: Planeta, 2015.";"Sánchez Arévalo, Daniel";"La isla de Alice";2015;"Primera edición";"Ficción";"Escrito";"Libro";"Novela";"España";;"Ficción";;"Escudarme en que era parte de mi investigación. Gajes del oficio. Un paso necesario para crear un vínculo en el cual Mark estuviera en mi poder. El sexo como moneda de cambio. Deseo, necesidad, poder, química, seducción, estrategia. Todo a la vez, revolviéndome. Y cuanto más tardaba en afrontarlo, más grande se iba haciendo la bola de nieve. «No es una justificación, Alice, es una realidad. Vas a colocar un chivato. Necesitas información. Y ya sé que nunca has hecho nada ni remotamente similar, que no va con tu estilo. Pero tampoco iba con tu";"si";"cuanto"
"Bunyol, Josep M.: Ahorrar en la factura eléctrica para Dummies. Barcelona: Centro Libros PAPF, 2015.";"Bunyol, Josep M.";"Ahorrar en la factura eléctrica para Dummies";2015;"Primera edición";"No ficción";"Escrito";"Libro";"Política, economía y justicia";"España";;"Divulgación";;"— La ""tarifa plana"" (en el mercado de precio regulado) es de precio y no de euros, cuanto más consumas, más pagarás... Eso sí a un precio fijo por kilovatio hora.";"si";"cuanto"
"Blue Jeans: Algo tan sencillo como twittear te quiero. Barcelona: Planeta, 2015.";"Blue Jeans";"Algo tan sencillo como twittear te quiero";2015;"Primera edición";"Ficción";"Escrito";"Libro";"Novela";"España";;"Ficción";;"— Cuanto más crece esta historia, más extraña me parece —confiesa Nicole negando con la cabeza.";"si";"cuanto"
"Laforet, Silvia: Dónde puedo alquilar una primavera. Madrid: Ediciones Martínez Roca, 2015.";"Laforet, Silvia";"Dónde puedo alquilar una primavera";2015;"Primera edición";"Ficción";"Escrito";"Libro";"Novela";"España";;"Ficción";;"instituto. Y si te cuento más, no acabo, porque entremedias el tío fue jesuita y estuvo un montón de años en el Amazonas, te lo juro, cuando me lo contó, no me lo podía creer, porque Arturo es republicano, como sus padres, y rojo, como dice él... Aunque cuanto más hablo con él, más convencido estoy de que no es de ningún color, no pertenece a ningún partido, ni es fanático de nada, eso me gusta. Arturo es justo, es un hombre justo. Él siempre dice que la vida son etapas. Y que su dios no tiene nada que ver con el";"si";"cuanto"
"Díez Nicolás, Juan; Morenos Páez, María: La soledad en España. Madrid: Fundación ONCE; Fundación AXA, 2015.";"Díez Nicolás, Juan; Morenos Páez, María";"La soledad en España";2015;"Primera edición";"No ficción";"Escrito";"Libro";"Salud";"España";;"Académico";;"Por ejemplo, diferentes estudios consideran la fuerte relación que existe entre soledad y salud, sobre todo durante la vejez, ya que cuanto más avanza la edad, más aumentan los problemas de salud. Sin embargo, María Teresa Bazo, en una investigación realizada sobre este tema, apunta que esta relación se produce de manera positiva en cualquier persona. Es más, aparece más fuerte la relación entre soledad y salud que entre edad y soledad, puesto que la percepción que se tiene";"si";"cuanto"
